,id,artist,first_artist,song,weeks_on_chart,peak_rank,lyrics,length,word_count,language,language_score
316,19,Dean Martin,Dean Martin,"Let It Snow, Let It Snow, Let It Snow",13,8,"Oh, the weather outside is frightful But the fire is so delightful And since we've no place to go Let it snow, let it snow, let it snow Man, it doesn't show signs of stopping And I've brought me some corn for popping The lights are turned way down low Let it snow, let it snow When we finally kiss goodnight How I'll hate going out in the storm But if you really hold me tight All the way home I'll be warm And the fire is slowly dying And, my dear, we're still goodbying But as long as you love me so Let it snow, let it snow, and snow When we finally kiss goodnight How I'll hate going out in the storm But if you really grab me tight All the way home I'll be warm Oh, the fire is slowly dying And, my dear, we're still goodbying But as long as you love me so Let it snow, let it snow, let it snow",799,167,en,0.9999975821476713
317,5733,Demi Lovato,Demi Lovato,Anyone,2,34,"Uh, uh  I tried to talk to my piano I tried to talk to my guitar Talked to my imagination Confided into alcohol I tried and tried and tried some more Told secrets 'til my voice was sore Tired of empty conversation 'Cause no one hears me anymore  A hundred million stories And a hundred million songs I feel stupid when I sing Nobody's listening to me Nobody's listening I talk to shooting stars But they always get it wrong I feel stupid when I pray So, why am I praying anyway? If nobody's listening  Anyone, please send me anyone Lord, is there anyone? I need someone, oh Anyone, please send me anyone Lord, is there anyone? I need someone  I used to crave the world's attention I think I cried too many times I just need some more affection Anything to get me by  A hundred million stories And a hundred million songs I feel stupid when I sing Nobody's listening to me Nobody's listening I talk to shooting stars But they always get it wrong I feel stupid when I pray Why the fuck am I praying anyway? If nobody's listening  Anyone, please send me anyone Lord, is there anyone? I need someone, oh Anyone, please send me anyone Oh, Lord, is there anyone? I need someone Oh, anyone, I need anyone Oh, anyone, I need someone  A hundred million stories And a hundred million songs I feel stupid when I sing Nobody's listening to me Nobody's listening",1349,250,en,0.9999950384365826
320,79,Dierks Bentley Featuring Brothers Osborne,Dierks Bentley,Burning Man,17,45,"Half your life you struggle Half your life you fly Half your life makin' trouble Half your life makin' it right One day I'm the exception Most days I'm just like most Some days I'm headed in the right direction And some days I ain't even close  I'm a little bit steady but still a little bit rollin' stone I'm a little bit heaven but still a little bit flesh-and-bone Little found, little don't-know-where-I-am I'm a little bit holy water but still a little bit burning man Burning man  I always loved the highway I just don't run it as fast I still go wherever the wind blows me But I always find my way back I still don't get it right sometimes I just don't get it as wrong I still go a little bit crazy sometimes Yeah, but now I don't stay near as long  I'm a little bit steady but still a little bit rollin' stone I'm a little bit heaven but still a little bit flesh-and-bone Little found, little don't-know-where-I-am I'm a little bit holy water but still a little bit burning man Burning man Still just a burn, burn, burning man Just a burning man Woo!  Maybe I'll go to the desert Find myself in the Joshua Tree If we pass in the night then just hand me a light And tell me you burned just like me  I'm a little bit steady but still a little bit rollin' stone I'm a little bit heaven but still a little bit flesh-and-bone Little found, little don't-know-where-I-am I'm a little bit holy water but still a little bit burning man Burning man Still just a burn, burn, burning man Just a burning man  Burning man",1515,288,en,0.9999975441043316
321,3477,Diplo Presents Thomas Wesley Featuring Morgan Wallen,Diplo Presents Thomas Wesley,Heartless,21,39,!NoSong!,8,1,tl,0.9999955635300002
331,10438,Donny Hathaway,Donny Hathaway,This Christmas,1,39,"Hang all the mistletoe I'm gonna get to know you better This Christmas And as we trim the tree How much fun it's gonna be together This Christmas  Fireside is blazing bright We're caroling through the night And this Christmas will be A very special Christmas for me  Presents and cards are here My world is filled with cheer and you This Christmas And as I look around Your eyes outshine the town they do This Christmas  Fireside is blazing bright We're caroling through the night And this Christmas will be A very special Christmas for me, yeah  Shake a hand, shake a hand now  Emm, fireside is blazing bright We're caroling through the night And this Christmas will be A very special Christmas for me, yeah  Merry Christmas Shake a hand, shake a hand now Wish your brother merry christmas All over the land, yeah Merry Christmas Merry, merry Christmas Hey, hey, hey, hey Merry, merry, merry, merry Emm, em",907,161,en,0.9999970582998094
353,8601,Drake Featuring Lil Durk,Drake,Laugh Now Cry Later,19,2,!Error!,7,1,de,0.9999950252852601
360,4529,Dua Lipa,Dua Lipa,Don't Start Now,52,2,"If you don't wanna see me  Did a full one-eighty, crazy Thinking 'bout the way I was Did the heartbreak change me? Maybe But look at where I ended up I'm all good already So moved on, it's scary I'm not where you left me at all, so  If you don't wanna see me dancing with somebody If you wanna believe that anything could stop me  Don't show up, don't come out Don't start caring about me now Walk away, you know how Don't start caring about me now  Aren't you the guy who tried to Hurt me with the word ""goodbye""? Though it took some time to survive you I'm better on the other side I'm all good already So moved on, it's scary I'm not where you left me at all, so  If you don't wanna see me dancing with somebody If you wanna believe that anything could stop me (Don't, don't, don't)  Don't show up, don't come out Don't start caring about me now Walk away, you know how Don't start caring about me now ('Bout me now, 'bout me)  Up, up Don't come out, out, out Don't show up, up, up Don't start now (Oh) Up, up Don't come out, out I'm not where you left me at all, so  If you don't wanna see me dancing with somebody If you wanna believe that anything could stop me  Don't show up (Don't show up), don't come out (Don't come out) Don't start caring about me now ('Bout me now) Walk away (Walk away), you know how (You know how) Don't start caring about me now (So)  Up, up Don't come out, out, out Don't show up, up, up Walk away, walk away (So) Up, up Don't come out, out, out Don't show up, up, up Walk away, walk away, oh",1526,304,en,0.9999978137322394
365,10444,Eagles,Eagles,Please Come Home For Christmas,9,18,"Bells will be ringing this sad, sad news Oh, what a Christmas to have the blues My baby's gone, I have no friends To wish me greetings once again Choirs will be singing ""Silent Night"" Christmas carols by candlelight Please come home for Christmas Please come home for Christmas If not for Christmas, by New Year's night Friends and relations send salutations Sure as the stars shine above But this is Christmas, yes, Christmas my dear The time of year to be with the ones you love So won't you tell me you'll never more roam Christmas and New Year's will find you home There will be no more sorrow, no grief and pain And I'll be happy, happy once again Ooh, there'll be no more sorrow, no grief and pain And I'll be happy, Christmas once again",743,138,en,0.9999964583395056
366,10458,Ed Sheeran,Ed Sheeran,Afterglow,1,59,"(One, two)  Stop the clocks, it's amazing You should see the way the light dances off your hair A million colours of hazel, golden, and red Saturday morning is fading The sun's reflected by the coffee in your hand My eyes are caught in your gaze all over again  We were love-drunk, waiting on a miracle Tryna find ourselves in the winter snow So alone in love like the world had disappeared Oh, I won't be silent and I won't let go I will hold on tighter 'til the afterglow And we'll burn so bright 'til the darkness softly clears  Oh, I will hold on to the afterglow Oh, I will hold on to the afterglow  The weather outside's changing The leaves are buried under six inches of white The radio is playing Iron & Wine This is a new dimension This is a level where we're losing track of time I'm holding nothing against it, except you and I  We were love-drunk, waiting on a miracle Tryna find ourselves in the winter snow So alone in love like the world had disappeared Oh, I won't be silent and I won't let go I will hold on tighter 'til the afterglow And we'll burn so bright 'til the darkness softly clears  Oh, I will hold on to the afterglow Oh, I will hold on to the afterglow Oh, I will hold on to the afterglow",1217,235,en,0.9999982268466221
373,2998,Ed Sheeran Featuring YEBBA,Ed Sheeran,Best Part Of Me,1,99,"My lungs are black, my heart is pure My hands are scarred from nights before And my hair is thin and falling out of all the wrong places I am a little insecure My eyes are crossed, but they're still blue I bite my nails and tell the truth I go from thin to overweight, day to day, it fluctuates My skin is inked, but faded, too  But she loves me, she loves me Why the hell does she love me When she could have anyone else? Oh, you love me, you love me Why the hell do you love me? 'Cause I don't even love myself  Baby, the best part of me is you And lately, everything's making sense, too Oh, baby, I'm so in love with you  I overthink and still forget I lose my phone and place my bets And I never catch the train on time Always 30 minutes behind Your worries ain't seen nothin' yet  But you love me, you love me Why the hell you love me so When you could have anyone else? Yeah, yeah, he loves me, he loves me And I bet he never lets me go And shows me how to love myself  'Cause, baby, the best part of me is you Oh, lately, everything's making sense, too Baby, I'm so in love with you  With you Da-dum, da-dum, da-dum, da-dum  Baby, the best part of me is you (Whoa) Lately, everything's making sense, too Oh, baby, I'm so in love with you (Oh) Baby, I'm so in love with you (Yeah, yeah) Oh, baby, I'm so in love with you",1326,271,en,0.9999960551614924
380,39,Elvis Presley,Elvis Presley,Blue Christmas,3,33,"I'll have a blue Christmas without you (Ooh, ooh, ooh, ooh) I'll be so blue just thinking about you (Ooh, ooh, ooh, ooh) Decorations of red on a green Christmas tree (Ahh, ahh) Won't be the same dear, if you're not here with me (Ooh)  And when those blue snowflakes start fallin' (Ooh, ooh, ooh, ooh) That's when those blue memories start callin' (Ooh, ooh, ooh, ooh) You'll be doin' all right, with your Christmas of white (Ahh, ahh) But I'll have a blue, blue, blue, blue Christmas  (Ooh, ah ooh) (Ooh, ah ooh)  You'll be doin' all right, with your Christmas of white (Ahh, ahh) But I'll have a blue, blue, blue, blue Christmas (Ooh, ooh, ooh, ooh)",650,119,en,0.9999949738165873
395,2275,Eric Church,Eric Church,Some Of It,13,43,"Beer don't keep Love’s not cheap And trucks don't wreck themselves Mama ain't a shrink Daddy ain't a bank And God ain't a wishin' well Money ain't rich Everybody sins And nobody wins in a fight And sometimes wrong is right  Some of it you learn the hard way Some of it you read on a page Some of it comes from heartbreak Most of it comes with age And none of it ever comes easy A bunch of it you maybe can't use I know I don't probably know what I think I do But there's something to some of it  Girls like to laugh Tears don't last And scared's what praying's for If it's close, swing the bat Everybody's got a past And love's worth living for When you dance, hold her close 'Til it breaks, go for broke Be the first to reach for her hand No, you don't get to do some things again  Some of it you learn the hard way Some of it you read on a page Some of it comes from heartbreak Most of it comes with age And none of it ever comes easy A bunch of it you maybe can't use I know I don't probably know what I think I do But there's something to some of it  When you can take it slow 'Cause time sure won't What really makes you a man Is being true to her 'til your glass runs out of sand  Some of it you learn the hard way Some of it you read on a page Some of it comes from heartbreak Most of it comes with age And none of it ever comes easy A bunch of it you maybe can't use I know I don't probably know what I think I do But there's something to some of it Some of it",1468,311,en,0.9999983238847153
400,1665,"Five Finger Death Punch Featuring Kenny Wayne Shepherd, Brantley Gilbert & Brian May",Five Finger Death Punch,Blue On Black,1,66,"Night falls and I'm alone Skin, yeah, chilled me to the bone You turned and you ran, oh, yeah Oh, slipped right from my hands  Yeah Blue on black—tears on a river Push on a shove—it don't mean much Joker on jack—match on a fire Cold on ice—a dead man's touch Whisper on a scream—never change a thing Doesn't bring you back It's like blue on black  Blind, oh, but now I see Truth, lies, and in between Wrong can't be undone—oh, no Well, it slipped from the tip of your tongue  Yeah Blue on black—tears on a river Push on a shove—it don't mean much Joker on jack—match on a fire Cold on ice—a dead man's touch Whisper on a scream—never change a thing Doesn't bring you back It's blue on black   Blue on black—tears on a river Push on a shove—it don't mean much  Blue on black—tears on a river Push on a shove—it don't mean much Joker on jack—match on a fire Cold on ice—a dead man's touch Whisper on a scream—never change a thing Doesn't bring you back It's blue on black  Yeah, blue on black Yeah, it's blue on black Yeah, blue on black",1035,199,en,0.9999964244514735
401,9320,Fleetwood Mac,Fleetwood Mac,Dreams,23,1,"Now here you go again, you say you want your freedom Well, who am I to keep you down? It's only right that you should play the way you feel it But listen carefully to the sound of your loneliness  Like a heartbeat drives you mad In the stillness of remembering what you had And what you lost And what you had And what you lost  Oh, thunder only happens when it's raining Players only love you when they're playing Say, women, they will come and they will go When the rain washes you clean, you'll know You'll know   Now here I go again, I see the crystal visions I keep my visions to myself It's only me who wants to wrap around your dreams And have you any dreams you'd like to sell? Dreams of loneliness  Like a heartbeat drives you mad In the stillness of remembering what you had And what you lost And what you had Oh, what you lost  Thunder only happens when it's raining Players only love you when they're playing Women, they will come and they will go When the rain washes you clean, you'll know  Oh, thunder only happens when it's raining Players only love you when they're playing Say, women, they will come and they will go When the rain washes you clean, you'll know  You'll know You will know Oh, you'll know",1220,231,en,0.9999962400848358
406,4584,Frank Ocean,Frank Ocean,In My Room,1,85,"No sleeper seats, that's a mattress No sleeper seats, that's a mattress You ain't stingy, split your tablets with me You won't flinch when camera's flashing, flashing Not fake laid back, no, it's natural And I think you made for the life I lead I'm not fake patient, I don't fake sick, huh That kinda coffin don't need lean Rest in peace Got this lust for life in me, yeah Horny for the game, uh First they kiss, then they bite soft, uh Then that bitch wanna play it off, huh Fuck it, I'm pretty still in a pit of snakes While serpents shake some brand new scales I need a new face, I'm tired of these weirdos Acting familiar, took all the rock And turned it to pop, he think that he Elvis And he ungrateful, they don't say thank you They don't say grace, not even for meals, not even for millions Fuck it, I'm pretty still, look at my deal Richard Mille, look at my ears, flooded with diamonds Look at my skills, running through blocks like 49ers Forty-nine diamonds, stuffed in my bracelet That cost a whop, that cost a whopper And it ain't new, I had a knot at John Ehret in my locker Pretty still, it ain't no pretty pill It's either real or real Real easy on the eyes, green like a soccer field Skin hot when they tried me like them poppers feel Hands shaking, norepinephrine levels skyrocket, fuel Rocket  Quit being violent with me (Yeah, why, why) Quit being violent with me Quit being violent with me You make me violent  My room, my room, my room with me Every night you were in my room My room, my room with me I guess I can't state my feelings too soon I don't know you And I can't put no threats in the air",1619,313,en,0.9999967980346148
430,2497,Future,Future,XanaX Damage,1,98,"Blood, blood, blood Xanax dreams, Xanax Covered in blood, oh  Baby, when the sun is out, it's like I'm not myself Xanax doin' damage, make it night so I can handle you Baby, when the moon is out, I finally know myself Xanny pills, then I feel my body startin' to give up, yeah  I only call you when I'm faded Your arms around me, come and save me I only want you to have my baby When I'm drunk and I'm down and depressed I just need to confess to you Oh, oh-oh  Baby, if I want you, then I know there's somethin' wrong I don't mean to ruin all the times we had alone But I'm not my best with you, I'm so depressed with you But it's so hard, I don't think I can exist without you  I only call you when I'm faded Your arms around me, come and save me I only want you to have my baby When I'm drunk and I'm down and depressed I just need to confess to you Oh, oh-oh  Baby, when the sun is out, it's like I'm not myself Xanax doin' damage, make it night so I can handle you Baby, when the moon is out, I finally know myself Xanny pills, then I feel my body startin' to give up, yeah",1078,224,en,0.99999855724176
445,7383,Future Featuring Young Thug,Future,Harlem Shake,1,84,"Chopper make him do the Harlem Shake (Wheezy Beats) Ayy  Trap money, ayy Snow bunnies, ayy Trap money, ayy Push start, ayy Racks tall, ayy Never fall, ayy Guitar, ayy Play with racks, ayy Trap star, ayy Brett Favre, ayy Money, cars, ayy Cook hard, ayy White chalk, ayy Nonstop, ayy Chopper make him do the Harlem Shake  YSL, ayy (Ayy) Saint Laurent, ayy (Ayy) Smart curve TV (What?) Smart car, ayy (Skrrt) Grab the carbine, ayy (Ayy) Let it spark, ayy (Brrat) Grab a jet, ayy (Ayy) Let's depart, ayy (Ayy, ayy, ayy) AK swang, Glock blastin' hard, ayy (Ayy, ayy) Ayy, ayy, let that Lamborghini Urus talk, ayy (Slatt, ayy) The chopper gon' pop it, just feel it, kneel it, woah, ayy (Ayy) Ayy, ayy, cruise your tongue with a cop, ayy  Trap money, ayy Snow bunnies, ayy Trap money, ayy Push start, ayy Racks tall, ayy Never fall, ayy Guitar, ayy Play with racks, ayy Trap star, ayy Brett Favre, ayy Money, cars, ayy Cook hard, ayy White chalk, ayy Nonstop, ayy Chopper make him do the Harlem Shake  Ray Charles, ayy You can still see him shinin' Drag racer, ayy Came through the trap glidin' Ran out of garage space Shit on you niggas, parquet Ayy, all this gas on me, I open up a gas station Spent a kilo on a mink coat, ayy, ayy, ayy Lil' shawty want some Henny and co-co, ayy, ayy Racks everywhere, Alpo, ayy Chopper make him do the Harlem Shake  Trap money, ayy Snow bunnies, ayy Trap money, ayy Push start, ayy Racks tall, ayy Never fall, ayy Guitar, ayy Play with racks, ayy Trap star Brett Favre Money, cars Cook hard, ayy White chalk, ayy Nonstop, ayy Chopper make him do the Harlem Shake  Do the Harlem Shake Har-Har-Har-Harlem Shake, Harlem Shake",1652,304,en,0.8571396477889504
450,10477,Gabby Barrett,Gabby Barrett,The First Noel,1,78,"The First Noel, the Angels did say Was to certain poor shepherds in fields as they lay In fields where they lay keeping their sheep On a cold winter's night that was so deep Noel, Noel, Noel, Noel Born is the King of Israel! They looked up and saw a star Shining in the East beyond them far And to the earth it gave great light And so it continued both day and night Noel, Noel, Noel, Noel Born is the King of Israel! Then let us all with one accord Sing praises to our heavenly Lord That have made heaven and earth of naught And with His blood mankind hath bought Noel, Noel, Noel, Noel Born is the King of Israel! Noel, Noel, Noel, Noel Born is the King of Israel!",666,132,en,0.9999964595233599
452,5799,Garth Brooks & Blake Shelton,Garth Brooks,Dive Bar,5,78,"Well turn that bottle up and drink it, crank that jukebox up and Hank it Bartender, pour another round Here's to our best bad decisions, situation no conditions Oh, and memories we all need to drown So, fill your cup and raise it up Jump in and join the club And float this whiskey river reservoir We're gonna spend the weekend in the deep end of a dive bar  'Cause up in here you're not the only loved and left her Lost and lonely one who's ever swam against the tide Thinkin' this is your oasis, it's the safest of the places That a broken heart can find to hide So, here's a toast coast to coast With a big old adios To wishes wasted on them fallin' stars We're gonna spend the weekend in the deep end of a dive bar  Yeah it's just chapter after chapter of happy never after But that's just the way the story goes For some barstool believers wear our heart out on our sleevers Just goin' where the neon glows   Yeah, it's just chapter after chapter of happy never after But that's just the way the story goes Yeah, we're just never quite belongers, hanger on-ers way too longers Just buzzin' where the neon glows  Problems, we all got 'em Let 'em sink down to the bottom Doesn't matter who or where you are We're gonna spend the weekend in the deep end The water's fine, y'all, so just come on in To the deep end of a dive bar Of this dive bar Talkin' 'bout a dive bar",1371,266,en,0.9999976353334135
453,27,Gene Autry,Gene Autry,Here Comes Santa Claus (Right Down Santa Claus Lane),10,26,"Here comes Santa Claus Here comes Santa Claus Right down Santa Claus Lane Vixen and Blitzen and all his reindeer Pullin' on the reins Bells are ringin', children singin' All is merry and bright So hang your stockings and say your prayers 'Cause Santa Claus comes tonight Here comes Santa Claus Here comes Santa Claus Right down Santa Claus Lane He's got a bag that's filled with toys For boys and girls again Hear those sleigh bells jingle jangle Oh, what a beautiful sight So jump in bed and cover your head 'Cause Santa Claus comes tonight Here comes Santa Claus Here comes Santa Claus Right down Santa Claus Lane He doesn't care if you're rich or poor He loves you just the same Santa Claus knows we're all Gods children That makes everything right So fill your hearts with Christmas cheer 'Cause Santa Claus comes tonight Here comes Santa Claus Here comes Santa Claus Right down Santa Claus Lane He'll come around when the chimes ring out That it's Christmas morn again Peace on earth will come to all If we just follow the light So let's give thanks to the Lord above 'Cause Santa Claus comes tonight Here comes Santa Claus Here comes Santa Claus Right down Santa Claus Lane Vixen and Blitzen and all his reindeer Pullin' on the reins Bells are ringin', children singin' All is merry and bright Hang your stockings and say your prayers 'Cause Santa Claus comes tonight",1373,245,en,0.999996789402122
454,15,Gene Autry,Gene Autry,Rudolph The Red-Nosed Reindeer,12,16,"You know Dasher, and Dancer, and Prancer, and Vixen Comet, and Cupid, and Donner and Blitzen But do you recall the most famous reindeer of all Rudolph the red-nosed reindeer had a very shiny nose And if you ever saw it, you would even say it glows All of the other reindeer used to laugh and call him names They never let poor Rudolph join in any reindeer games Then one foggy Christmas Eve Santa came to say ""Rudolph with your nose so bright, won't you guide my sleigh tonight?"" Then how the reindeer loved him as they shouted out with glee ""Rudolph the red-nosed reindeer, you'll go down in history"" Rudolph the red-nosed reindeer had a very shiny nose And if you ever saw it, you would even say it glows All of the other reindeer used to laugh and call him names They never let poor Rudolph join in any reindeer games Then one foggy Christmas Eve Santa came to say ""Rudolph with your nose so bright, won't you guide my sleigh tonight?"" Then how the reindeer loved him as they shouted out with glee ""Rudolph the red-nosed reindeer, you'll go down in history""",1060,196,en,0.9999976462558633
