,id,artist,first_artist,song,weeks_on_chart,peak_rank,lyrics,length,word_count,language,language_score
1070,6045,Sam Smith,Sam Smith,To Die For,6,46,"It is if everyone dies alone Does that scare you? I don't wanna be alone  I look for you Every day, every night I close my eyes From the fear, from the light  As I wander down the avenue, so confused Guess I'll try and force a smile  Pink lemonade sippin' on a Sunday Couples holding hands on a runway They're all posing in a picture frame Whilst my world's crashing down Solo shadow on a sidewalk Just want somebody to die for Sunshine livin' on a perfect day While my world's crashing down I just want somebody to die for  I long for you Just a touch (Does that scare you?) Of your hand You don't leave my mind Lonely days, I'm feeling Like a fool for dreaming  As I wander down the avenue, so confused Guess I'll try and force a smile  Pink lemonade sippin' on a Sunday Couples holding hands on a runway They're all posing in a picture frame Whilst my world's crashing down Solo shadow on a sidewalk Just want somebody to die for Sunshine livin' on a perfect day While my world's crashing down I just want somebody to die for  I just want somebody to die for (To die for) I just want somebody to die for (Does that scare you?) (I don't wanna be alone)  Pink lemonade sippin' on a Sunday Couples holding hands on a runway (Oh) They're all posing in a picture frame Whilst my world's crashing down Solo shadow on a sidewalk Just want somebody to die for Sunshine livin' on a perfect day While my world's crashing down I just want somebody to die for I just want somebody to die for (To die for)",1495,287,en,0.9999949361603195
1071,6935,Sam Smith & Demi Lovato,Sam Smith,I'm Ready,4,36,"It's a cold night in my bed in the heat of the summer I've been waitin' patiently for a beautiful lover He's not a cheater, a believer He's a warm, warm-blooded achiever It's a lonely night in my bed in the heat of the summer, oh  It's so hard when you're with someone Your heart breaks and it ain't no fun But I gotta take that risk tonight  I'm ready, I'm ready, I'm ready, I'm ready For someone to love me (For someone to love me) I'm ready (I'm ready), I'm ready (I'm ready) I'm ready (I'm ready), I'm ready (I'm ready) For someone to love me, for someone to love me  Oh, yeah It's a hot night in my head in the chill of the winter No, I've been lookin' hard for a lover disguised as a sinner No, not a cheater, a redeemer He's a cold, cold-blooded defeater It's a hot night in my head in the chill of the winter, no  It's so hard when you're with someone Your heart breaks and it ain't no fun (Breaks) But I gotta take that risk tonight  I'm ready, I'm ready, I'm ready, I'm ready For someone to love me (For someone to love me) I'm ready (I'm ready), I'm ready (I'm ready) I'm ready (I'm ready), I'm ready (I'm ready) For someone to love me, for someone to love me, yeah  Oh, oh It's a cold night in my bed in the heat of the summer No, I've been lookin' hard for a lover disguised as a sinner  I'm ready (I'm ready), I'm ready (I'm ready) I'm ready (I'm ready), I'm ready (I'm ready) For someone to love me (For someone to love me) I'm ready (I'm ready), I'm ready (I'm ready) I'm ready (I'm ready), I'm ready (I'm ready) For someone to love me, for someone to love me",1575,311,en,0.9999973322277311
1072,332,Sam Smith & Normani,Sam Smith,Dancing With A Stranger,45,7,"Hmm, mhm  I don't wanna be alone tonight (Alone tonight) It's pretty clear that I'm not over you (Over you, over you) I'm still thinking 'bout the things you do (Things you do) So I don't wanna be alone tonight, alone tonight, alone tonight Can you light the fire? (Light the fire, light the fire) I need somebody who can take control (Take control) I know exactly what I need to do 'Cause I don't wanna be alone tonight, alone tonight, alone tonight  Look what you made me do, I'm with somebody new Ooh, baby, baby, I'm dancing with a stranger Look what you made me do, I'm with somebody new Ooh, baby, baby, I'm dancing with a stranger Dancing with a stranger  I wasn't even going out tonight (Out tonight) But, boy, I need to get you off of my mind (Off of my mind) I know exactly what I have to do I don't wanna be alone tonight, alone tonight, alone tonight  Look what you made me do, I'm with somebody new Ooh, baby, baby, I'm dancing with a stranger Look what you made me do, I'm with somebody new Ooh, baby, baby, I'm dancing with a stranger Dancing with a stranger Dancing with a stranger Dancing, yeah, ooh  Look what you made me do, I'm with somebody new (Ooh) Ooh, baby, baby, I'm dancing with a stranger Look what you made me do, I'm with somebody new Ooh, baby, baby, I'm dancing with a stranger I'm dancing, I'm dancing (Ooh) I'm dancing, I'm dancing (Dancing with a stranger) I'm dancing, I'm dancing (Dancing with a stranger) I'm dancing, I'm dancing (Dancing with a stranger)",1493,277,en,0.9999948766712421
1080,6892,Scotty McCreery,Scotty McCreery,In Between,13,53,"I'm a little bit a ball cap Little bit a pearl snap button down shirt Little bit a big city concrete But a lot more small town dirt  I can see your pretty eyes Reading me like a map Wondering who I am And where I'm at  I'm in between Friday night wild And quiet Sunday morning Between Done after one And keep on pouring Ain't too high Ain't too low Just holding down the middle I'm steady as I go I ain't all holy water And I ain't all Jim Beam I'm somewhere in between  I can be a steel toe work boot 40 hour blue collar, mud on my jeans Then on weekend pack a bag Disappear kick back on a white sand beach  I'm a far cry from being A one night stand But I ain't ready For a ring on my hand  I'm in between Friday night wild And quiet Sunday morning Between Done after one And keep on pouring Ain't too high Ain't too low Just holding down the middle I'm steady as I go I ain't all holy water And I ain't all Jim Beam I'm somewhere in between  I can see your pretty eyes Reading me like a map Wondering who I am And where I'm at  I'm in between Friday night wild And quiet Sunday morning Between Done after one And keep on pouring Ain't too high Ain't too low Just holding down the middle I'm steady as I go I ain't all holy water And I ain't all Jim Beam I'm somewhere in between Yeah I'm somewhere in between",1311,268,en,0.9999957534947289
1081,99,Scotty McCreery,Scotty McCreery,This Is It,20,42,"Way up in the mountains, four thousand feet high There's a trail through the trees to a cliff where Carolina meets the sky Oh, and there's a view I just can't describe No, we're not there yet, just a few more steps, baby wait Okay, you can open your eyes  This is it, this is now, this is what I've been talking 'bout Looking out, can't you see forever? Take my hand, just take it in This is a moment we won't forget On top of the world, here, together If there ever was a time for a perfect kiss, this is it  Girl, I know that you've been waiting and talking to your friends Wondering if and wondering where and wondering when Well, I've been waiting too, holding on to this ring For the right words to say, for the right time and place, for me to get on one knee  This is it, this is now, this is what I've been talking 'bout Looking out, can't you see forever? Take my hand, just take it in This is a moment we won't forget On top of the world here together If there ever was a time for a perfect kiss, well this is it This is it  Now you're walking down the aisle And I can't help but smile  This is it, this is now, it's what I've been talking 'bout Looking out, I can see forever So take my hand, just take it in (Take it in) This is a moment we won't forget (Won't forget) On top of the world, here, together Surrounded by our family and our friends If there ever was a time for a perfect kiss This is it Yeah, this is it",1428,290,en,0.9999958645720539
1090,9317,Shawn Mendes,Shawn Mendes,Wonder,10,18,"I wonder if I'm being real Do I speak my truth or do I filter how I feel? I wonder, wouldn't it be nice To live inside a world that isn't black and white? I wonder what it's like to be my friends Hope that they don't think I'll forget about them I wonder, I wonder  Right before I close my eyes The only thing that's on my mind Been dreamin' that you feel it too I wonder what it's like to be loved by you, yeah I wonder what it's like I wonder what it's like to be loved by  I wonder why I'm so afraid Of saying something wrong, I never said I was a saint I wonder, when I cry into my hands I'm conditioned to feel like it makes me less of a man And I wonder if someday you'll be by my side And tell me that the world will end up alright I wonder, I wonder  Right before I close my eyes The only thing that's on my mind Been dreamin' that you feel it too I wonder what it's like to be loved by you, yeah I wonder what it's like I wonder what it's like to be loved by you  I wonder what it's like to be loved by you, yeah I wonder what it's like to be loved by you I wonder what it's like to be loved by—  Right before I close my eyes The only thing that's on my mind Been dreamin' that you feel it too I wonder what it's like to be loved by you",1245,268,en,0.9999953096405768
1091,2601,Shawn Mendes & Camila Cabello,Shawn Mendes,Senorita,37,1,!Error!,7,1,de,0.9999956939775314
1092,10007,Shawn Mendes & Justin Bieber,Shawn Mendes,Monster,5,8,"You put me on a pedestal and tell me I'm the best Raise me up into the sky until I'm short of breath (Yeah) Fill me up with confidence, I say what's in my chest Spill my words and tear me down until there's nothin' left Rearrange the pieces just to fit me with the rest, yeah  But what if I, what if I trip? What if I, what if I fall? Then am I the monster? Just let me know And what if I, what if I sin? And what if I, what if I break? Yeah Then am I the monster? Yeah Just let me know, yeah  I was fifteen when the world put me on a pedestal I had big dreams of doin' shows and making memories Made some bad moves tryin' to act cool, upset by their jealousy, uh Liftin' me up (Liftin' me up), liftin' me up (Yeah) And tearin' me down (Down), tearin' me down (Down, down, yeah) I'll take responsibility for everything I've done (Yeah) Holdin' it against me like you're the holy one (Yeah)  I had a chip on my shoulder, had to let it go 'Cause unforgiveness keeps them in control I came in with good intentions, then I let it go And now I really wanna know  What if I, what if I trip? (Oh) What if I, what if I fall? (I fall) Then am I the monster? (Am I the monster?) Just let me know (Let me know) And what if I, what if I sin? (Oh) And what if I, what if I break? Yeah (What if I break?) Then am I the monster? (Am I the monster?) Just let me know (Oh, please just let me know, yeah)  La-da-da-duh-duh (Baby, what if I fall down?) La-da-da-duh-duh-duh-na La-da-da-da-duh-duh La-da-da-duh-duh-duh-na La-da-da-duh-duh (Please don't let me fall) La-da-da-duh-duh-duh-na La-da-da-da-duh-duh (Oh, please don't let me fall) La-da-da-duh-duh-duh-na",1644,317,en,0.9999975476194387
1094,16,Sheck Wes,Sheck Wes,Mo Bamba,28,6,!Error!,7,1,de,0.9999975845367379
1100,4172,Summer Walker,Summer Walker,Body,1,73,"We got London on da Track  I been all in my phone, I got options And I don't wanna tell you to drop it But I don't wanna play unfair, yeah, yeah Somethin' that makes me look at you too often And baby, you can give it somethin' Baby, I can run overtime, oh  Baby, I'm talkin' crazy I need you right in my space, but I Need it, baby, I'm late, but I Still can check in with you I know that I need my friend, but I Wouldn't wanna leave you, no, oh, I Wouldn't wanna plead But my heart, my mind and my body is sayin' (Sayin', sayin') My mind, my mind, and my body is My body is sayin' (Sayin', sayin') My mind, my mind, and my heart My body is sayin'  I don't know what it is I can't tell you what it is But you got me goin' crazy Sex with you is so amazin' How, how long can you go, baby? Better last 'til my body's sore, 'cause it's crazy  Baby, I'm talkin' crazy I need you right in my space, but I Need it, baby, I'm late, but I Still can check in with you I know that I need my friend, but I Wouldn't wanna leave you, no, oh, I Wouldn't wanna plead But my heart, my mind and my body is sayin' (Sayin', sayin') My mind, my mind, and my body is My body is sayin' (Sayin', sayin') My mind, my mind, and my heart My body is sayin'  I know, oh, I I know, oh, I I know we ain't gotta talk, alright I know you ain't gotta talk, alright Baby, I, I just wanna talk to you I just wanna talk to you Done with that shit, done with that shit Know what I would give, I",1455,309,en,0.9999971585897581
1101,4178,Summer Walker,Summer Walker,Drunk Dialing...LODT,1,79,"It's 3:34 and I don't need no more You can call it what you want, but I'ma call it dumb Too much liquor known to make you call a nigga And I done had too much Which is givin' me excuses to  Make me think I want you when I don't and I know this Know that you a dog, you always do me wrong, oh But it made me wanna call you like I'm on one and I want some And I need you to come over (Oh no, ah)  Too much Patrón'll have you callin' his phone or Have you wantin' some more, have you wantin' some more Too much Patrón'll have you callin' his phone or Have you wantin' some more  Oh, damn   Boy, you know I, I, I love you Oh, with everything you do, eh-eh And I just can't quite understand it But love makes sense of you (Yeah, eh) 'Cause I love you, but I know I wouldn't wanna wait For your heart to finally see me through And I'd love for you, do-do-do Yeah, said I",864,183,en,0.9999950087172245
1103,4179,Summer Walker,Summer Walker,Over It,1,80,"Am I really that much to handle? Breakin' these niggas down like enamel (Oh) Yet I'm ready to blow you out like a candle Can I really just blow you out like a candle? You a man, you say you the man (Oh) You say you 'bout it, you say you got it planned (Oh) I really wasn't tryna listen You say I ain't got no discipline (Oh) And that there why I wasn't listenin' (Oh)  But I need a nigga who can handle me (Oh) I want a, a nigga who can handle me, oh Nigga keep your hands off me You wanna stay with me But nigga, you just a fan of me (Fan of me) Cuff your bitch, nigga Nigga, cuff your bitch Caught you slippin' and a nigga hit a lick on you Are you really tellin' me that... I could break you down like a gym, sweat  Fuck it and catch me at V-Live I'll be sippin' D'USSE 'til I diz-ie Actin' like he care, he just don't driz-ive I be tryna numb the pain, I be so hiz-igh (Oh) Fuck it, you can catch me in the Hills (Oh) Watch me close 'cause I'll be poppin' pills (Oh, oh) All I ask for you to keep it trill (Oh) All I ask for you to keep it real, real, real, real, real  Oh, oh, oh, oh, oh Real, real, trill, keep one hunnid, oh no Not too much emotion, no, no You know I been fucked up, yeah, yeah I should keep it trill, trill for me I should keep it real, real, one hunnid",1278,271,en,0.9999974009544635
1104,3586,Summer Walker,Summer Walker,Playing Games,20,16,!Error!,7,1,de,0.8571382385766981
1105,4191,Summer Walker,Summer Walker,Potential,1,92,"You got potential, you got, you You got potential, you got, you You got potential (Potential, yeah, yeah) You got potential, you got, you  Had a few niggas ride or die for me Tell me, baby, will you slide for me? Keep the Glock 40, holding it down for me I know you're good in the hood, bust a couple juugs for me, yeah When I’m on the low, will you still cover for me? Blowin' bands to make me feel lovely When I'm gone, will you still think of me? I need to know for sure  ’Cause you got potential, you got, you You got potential, you got, you You got potential (Potential, yeah, yeah) You got potential, you got, you  Caught my interest, talkin' that shit So intriguing (Yeah, yeah) We could go far, go the distance I could see it (Yeah) I'm not tryna be out here with my hopes up If you all for me, then let me know what's up Don't change up on me in the long run Keep it open, one hunnid  'Cause you got potential, you got, you You got potential, you got, you You got potential (Potential, yeah, yeah) You got potential, you got, you",1038,204,en,0.9999989325874311
1108,4167,Summer Walker Featuring A Boogie Wit da Hoodie,Summer Walker,Stretch You Out,1,68,"We got London on da track  Niggas be insecure Claiming that you ain't doing enough Claiming that they need more What you on your last breath, your last sweat, your last dime? Out of your fucking mind Can't you see I'm fucking trying? You want pussy six times a week And you never wanna clean up And you talk to me like shit And you handle me too rough And at the end of the day, you got the nerve to bring up that bitch But that's the difference And when I feel like this, I can't take no more  Ain't gon' stress you out, out, out, out, out (Yeah, yeah) We gon' stretch you out, out, out, out, out We just wanna have fun, fun, fun, oh, oh We wanna make you cum, cum, cum, cum, cum  Girl, I heard that you been hurtin' Just let me know if it ain't workin' I could put mad baguettes on you on purpose We can go half on a baby on purpose In the Maybach, let's close all of the curtains purposely Everything you do to me, you do it perfectly And I be in your body like surgery I got insomnia, I gotta pop a percy to sleep, yeah Throw that ass 'round in a circle please, yeah Throw that ass 'round in a circle for me, yeah Like you working for me Don't you show no other nigga what you learning from me, yeah  Ain't gon' stress you out, out, out, out, out (Yeah, yeah) Whenever, whatever We gon' stretch you out, out, out, out, out Whenever, wherever We just wanna have fun, fun, fun, oh, oh We wanna make you cum, cum, cum, cum, cum  We gonna smile Whenever, whatever, yeah Whenever, wherever",1488,295,en,0.9999961000499025
1110,986,Summer Walker X Drake,Summer Walker,Girls Need Love,20,37,"Honestly Honestly, I'm tryna stay focused You must think I've got to be joking when I say I don't think I can wait I just need it now Better swing my way I just need some dick I just need some love Tired of fucking with these lame niggas baby I just need a thug Won't you be my plug, ayy You could be the one, ayy We could start with a handshake baby I'ma need more than a hug  Girls can't never say they want it Girls can't never say how Girls can't never say they need it Girls can't never say now Girls can't never say they want it Girls can't never say how Girls can't never say they need it Girls can't never say now oh now  Give it to me like you need it, baby Want you to hear me screaming, heavy breathing I don't need a reason baby I want it till you can't fight I can give it to you right babe oh I wanna be your healing I can be real good Please don't get in your feelings Ayy, I need some lo-o-o-o-ove Ayy, I need some lo-o-o-o-ove Ayy, I need some lo-o-o-o-ove Ayy, and you can't judge  Girls need love too (Yeah) Girls, girls need love too Girls need love (Let me tell you something) Girls need love (Girls need loving too) Girls need love too So what's a girl to do when she needs loving too",1206,245,en,0.9999967661026448
1111,7499,Surf Mesa Featuring Emilee,Surf Mesa,ily,28,23,Bang by AJR ILY By surf mesa Diamond by Sam smith Lyin 2 me By Cg5 Every door by Cg5 Any fnaf song by anyone Believer by imagine dragons I got no time by Cg5 or the living tombstone Show urself By Cg5 Everything black by Unlike pluto Bad guy By yall know who Copycat by yall know who House of memories by Panic! at the disco Tryphobia or any other meme song like tryphobia Twisted by MISSO Opinions by Cg5 Survive the night by mandopony It's me by tryhardninja Just gold by mandopony Megalovania by TOBY FOX Animals by neon trees Courtesy call by thousand foot crutch Trampoline by SHAED Positions by Ariana grande Shooting stars by bag raiders,644,120,en,0.9999971472320162
1112,6297,Surfaces,Surfaces,Sunday Best,21,19,"Good, feeling good  Ayy, feeling good, like I should Went and took a walk around the neighborhood Feeling blessed, never stressed Got that sunshine on my Sunday best (Yeah, ayy, ayy)  Every day can be a better day, despite the challenge All you gotta do is leave it better than you found it It's gonna get difficult to stand, but hold your balance I just say whatever 'cause there is no way around it 'cause  Everyone falls down sometimes But you just gotta know it'll all be fine It's okay, uh-huh-huh, uh It's okay, it's okay  Ayy, feeling good like I should Went and took a walk around the neighborhood Feeling blessed, never stressed Got that sunshine on my Sunday best (Ayy)  Some days you wake up and nothing works, you feel surrounded Gotta give your feet some gravity to get you grounded Keep good things inside your ears just like the waves and sound did And just say whatever 'cause there is no way around it  Everyone falls down sometimes But you just gotta know it'll all be fine It's okay, uh-huh-huh, uh It's okay, it's okay  Ayy, feeling good, like I should Went and took a walk around the neighborhood Feeling blessed, never stressed Got that sunshine on my Sunday best Ayy, feeling good, like I should Went and took a walk around the neighborhood Feeling blessed, never stressed Got that sunshine on my Sunday best",1331,238,en,0.9999954883792452
1113,3474,Swae Lee Featuring Drake,Swae Lee,Won't Be Late,1,75,"EarDrummers  Tell 'em again, tell 'em off (Tell 'em off) It just dawned on me (On me), what's right, feels wrong No, no wingman, that's only my A-game At this game, two can play Kill your vibe, they don't have the right Baby don't fight it, you're giving me life Take your time, set the mood right Settle down, skeptical at first but now I'm not  Won't be late, won't delay (Hey) Won't be late, won't delay (Yeah)  Yeah, yeah, saving my time for you Suddenly I freed up (Free) Freezing my times with you When I'm lonely, I can bring them up Closed off my line for you (Closing down my line) I'm better when I'm just on my own, girl Standing in line for you (Standing in line for you) Standing here for I don't know how long, girl Things I wrote (Ayy), lengths I go Lets you know that I want you Words we spoke (Yeah), things you wrote Let me know that you want me too (Yeah) Ikebe, pressing on me heavy Pressing up against me real close Bakasi, moving on me wassy Time is moving real slow  Won't be late, won't delay (Hey) Won't be late, won't delay (Yeah) Won't be late, won't delay (Hey) Won't be late, won't delay (Yeah)",1123,216,en,0.9999974329611556
1115,7000,"THE SCOTTS, Travis Scott & Kid Cudi","THE SCOTTS, Travis Scott",The Scotts,13,1,"Let's go  We see the hype outside (Yeah) Right from the house, uh Took it straight from outside (Yeah) Straight to the couch (Mmm) We put the mic outside (Yeah) Air this shit out, uh (Mmm) You lettin' THE SCOTTS outside (Yeah) We runnin' the scouts (Mmm) Ain't no controllin' the gang (Yeah, yeah, yeah) They never leave (Mmm) I got tats over my veins (Yeah) 'Cause that what I bleed (Mmm) She drink a lot of the bourbon (Yeah) Like she from the street (Mmm) We got control of the flows and, huh, uh, uh (Yeah, mmm) We heard that your way went dry (Yeah) We floodin' the drought, uh (Mmm) Heard that your hood outside (Yeah) We added some routes (Mmm) We havin' the goods outside (Mmm) Move it in and out (Mmm) You lettin' THE SCOTTS outside (Mmm) We runnin' the scouts  Nigga, the cops outside (Yeah) Lock up the house (Yeah, yeah) We keep the team on high (Huh) Some gold in they mouth (Yeah, yeah) Nigga, the Porsche outside (Huh) Without the top (Yeah, yeah, nigga, yeah) She want a mimosa-sa (Yeah) Bring in the shots (Yeah, yeah, yeah) Tell these phony bitches, ""Beat it"" With that Photoshoppin' body, Adobe, help me She in there makin' panini She know I got all the bread, she know me, got it On my hustle, havin' visions It's been a minute since my niggas done owned it, howdy (Huh, huh) Cleveland boy, he make 'em pay Yes, that Cleveland boy, he done made a way, hey Headed for somewhere to go, anywhere cinema these, these Niggas don't know where to go, gotta keep givin' em heat, heat (Yeah) Time to go double though, time they add up the math, mad And I've been dealin' with so many things, havin' so many dreams  Let's go",1634,306,en,0.9999979269663432
1122,8300,Taylor Swift,Taylor Swift,Cardigan,14,1,!Error!,7,1,de,0.9999945164422983
