,id,artist,first_artist,song,weeks_on_chart,peak_rank,lyrics,length,word_count,language,language_score
32,8098,6ix9ine,6ix9ine,YaYa,1,99,"Ransom got that sauce in it Se pinta los labio', hoy no tiene horario Quiere que la busque en la Lambo Esta noche coronamo' Dale, para terminar lo que empezamo' Oh-oh, baila morena, baila morena Oh-oh, baila morena, baila morena (Baila, baila) Oh-oh, baila morena, baila morena Oh-oh, oh-oh  Una nena así me hacía falta Que metiera mi mano por su falda Se ve que no e' santa Es como yo, que le gusta la maldad Dale, baby, no sea' mala No pare' de moverte que eso me encanta Bebecita, dame una, una probaíta' Tú ere' una mamacita Cuando chingamo', baby, tú nunca te quita' Mueve to' ese booty, tan chulita como Anitta  Tú 'tá dura, manina, nini, yaya Dame tequila, no quiero vaina' Baila, le subo la mini, yaya Tráeme bebida, no quiero agua Quiero manina, nini, yaya (Yaya, yaya) Dame tequila, no quiero vaina' (Yaya, yaya) Baila, le subo la mini, yaya Tráeme bebida, no quiero agua  Ponte friki, frikitona Tú ere' una chapi-chapiadora Ella e' bellaquísima, pero no se enamora Mami, y chingando hay que darte un diploma Ninguna se te iguala Ella me dice: ""Vente, papi"", me la saca (Saca) Y me baila flow Shakira, waka-waka (Waka) Ella tiene culo bello pero e' flaca La baby e' flaca  Quiero manina, nini, yaya Dame tequila, no quiero vaina' Baila, le subo la mini, yaya Tráeme bebida, no quiero agua  La baby 'tá borracha Rakatá, rakatá, rakatá, rakatá Rakatá, rakatá, rakatá, rakatá Mami, ta-ta-ta-ta-ta-ta-ta-ta Ta-ta-ta-ta-ta-ta-ta-ta Ta-ta-ta-ta-ta-ta-ta-ta Ta-ta-ta-ta-ta-ta-ta-ta Ta-ta-ta-ta-ta-ta-ta-ta  Quiero mainini, nini, yaya Dame tequila, no quiero vaina' Baila, le subo la mini, yaya Tráeme bebida, no quiero agua  Luian Mambo Kingz Jowny BF (Fya, fya, fya, fya)",1675,279,es,0.9999943695546136
61,12,Andy Williams,Andy Williams,It's The Most Wonderful Time Of The Year,20,5,"It's the most wonderful time of the year With the kids jingle belling And everyone telling you ""be of good cheer"" It's the most wonderful time of the year  It's the hap-happiest season of all With those holiday greetings And gay happy meetings when friends come to call It's the hap-happiest season of all  There'll be parties for hosting Marshmallows for toasting And caroling out in the snow There'll be scary ghost stories And tales of the glories Of Christmases long, long ago  It's the most wonderful time of the year There'll be much mistletoeing And hearts will be glowing when loved ones are near It's the most wonderful time of the year  There'll be parties for hosting Marshmallows for toasting And caroling out in the snow There'll be scary ghost stories And tales of the glories Of Christmases long, long ago  It's the most wonderful time of the year There'll be much mistletoeing And hearts will be glowing when loved ones are near It's the most wonderful time It's the most wonderful time It's the most wonderful time It's the most wonderful time of the year",1072,187,en,0.9999966641856749
74,21,Ariana Grande,Ariana Grande,Breathin,25,12,"​​lacigam gnihtemos od oT ​​thgin laiceps ruoy s'thginot tuB  Some days, things just take Way too much of my energy I look up and the whole room's spinning You take my cares away I can so over-complicate, people tell me to medicate  Feel my blood runnin', swear the sky's fallin' I know that all this shit's fabricated, mmm Time goes by and I can't control my mind Don't know what else to try, but you tell me every time  Just keep breathin' and breathin' and breathin' and breathin' And oh, I gotta keep, keep on breathin' Just keep breathin' and breathin' and breathin' and breathin' And oh, I gotta keep, keep on breathin', mmm-mmm  Sometimes it's hard to find Find my way up into the clouds Tune it out, they can be so loud You remind me of a time When things weren't so complicated All I need is to see your face  Feel my blood runnin', swear the sky's fallin' I know that all this shit's fabricated, mmm Time goes by and I can't control my mind Don't know what else to try, but you tell me every time  Just keep breathin' and breathin' and breathin' and breathin' And oh, I gotta keep, I keep on breathin' Just keep breathin' and breathin' and breathin' and breathin' And oh, I gotta keep, I keep on breathin', mmm, yeah  My, my air, my, my air My, my air, my air My, my air, my, my air My, my air, yeah  Just keep breathin' and breathin' and breathin' and breathin' And oh, I gotta keep, I keep on breathin' Just keep breathin' and breathin' and breathin' and breathin' And oh, I gotta keep, I keep on breathin', mmm, yeah  Feel my blood runnin', swear the sky's fallin', oh, whoa I keep on breathin', oh yeah Time goes by and I can't control my mind I keep on breathin', mmm, yeah",1688,318,en,0.99999656065146
76,724,Ariana Grande,Ariana Grande,Ghostin,2,25,!Error!,7,1,de,0.999996175930482
77,70,Ariana Grande,Ariana Grande,Imagine,8,21,"Step up, the two of us, nobody knows us Get in the car like, ""Skrrt"" Staying up all night, order me pad thai Then we gon' sleep 'til noon Me with no makeup, you in the bathtub Bubbles and bubbly, ooh This is a pleasure, feel like we never act this regular  Click, click, click and post Drip-drip-dripped in gold Quick, quick, quick, let's go Kiss me and take off your clothes  Imagine a world like that Imagine a world like that We go like up 'til I'm 'sleep on your chest Love how my face fits so good in your neck Why can't you imagine a world like that? Imagine a world  Knew you were perfect after the first kiss Took a deep breath like, ""Ooh"" Feels like forever, baby, I never thought that it would be you Tell me your secrets, all of the creep shit That's how I know it's true Baby, direct it, name in the credits Like the movies do  Click, click, click and post Drip-drip-dripped in gold Quick, quick, quick, let's go Kiss me and take off your clothes  Imagine a world like that Imagine a world like that We go like up 'til I'm 'sleep on your chest Love how my face fits so good in your neck Why can't you imagine a world like that? Imagine a world  Can you imagine it? Can you imagine it? Can you imagine it? Can you imagine it? Can you imagine it? (Can you imagine?) Can you imagine it? (Can you imagine?) Can you imagine it? (Can you imagine?) Ooh, imagine it (Can you imagine?) Imagine it, imagine it Imagine it, imagine it Imagine, imagine Imagine, imagine Imagine, imagine",1485,283,en,0.9999967303857452
82,9764,Ariana Grande,Ariana Grande,My Hair,1,65,"Said I'ma give you some instructions That you can't be scared to try I want you to touch it softly Like the way you do my mind It got body and it's smooth to touch The same way as my skin But don't you be scared  To run your hands through my hair Baby, 'cause that's why it's there Come run your hands through my hair Ooh, baby, so don't you be scared So come run your hands through my hair  It's been way long overdue Just like these inches down my back Usually don't let people touch it But tonight, you get a pass Spend my dimes and spend my time To keep it real, sometimes it's tracks But I don't care, mmm  So run your hands through my hair Baby, 'cause that's why it's there Come run your hands through my hair Ooh, baby, so don't you be scared So come run your hands through my hair  Know this ain't usually mе But I might let it down for ya (Mmm) This ain't usually me (Usually me) But I might lеt it down for ya  So run your hands through my hair Baby, 'cause that's why it's there So come run your hands through my hair Ooh, don't you be scared Come run your hands through my hair  Oh-oh, oh-oh Oh-oh, oh-oh",1117,224,en,0.9999980407596984
85,713,Ariana Grande,Ariana Grande,Needy,4,14,"If you take too long to hit me back I can't promise you how I’ll react But all I can say is at least I'll wait for you Lately, I've been on a roller coaster Tryna get a hold of my emotions But all that I know is I need you close  I’ma scream and shout for what I love Passionate, but I don't give no fucks I admit that I'm a lil' messed up But I can hide it when I'm all dressed up I'm obsessive and I love too hard Good at overthinking with my heart How you even think it got this far, this far?  And I can be needy, way too damn needy I can be needy, tell me how good it feels to be needed I can be needy, so hard to please me I know it feels so good to be needed  Sorry if I'm up and down a lot (Yeah) Sorry that I think I'm not enough And sorry if I say sorry way too much You can go ahead and call me selfish (Selfish) But after all this damage, I can’t help it (Help it) But what you can trust is I need your touch  I’ma scream and shout for what I love Passionate, but I don't give no fucks I admit that I’m a lil' messed up But I can hide it when I'm all dressed up I'm obsessive and I love too hard Good at overthinking with my heart How you even think it got this far, this far?  And I can be needy, way too damn needy I can be needy, tell me how good it feels to be needed I can be needy, so hard to please me I know it feels so good to be needed",1357,299,en,0.9999970616901431
86,9769,Ariana Grande,Ariana Grande,Obvious,1,70,"I love the taste of you in the morning Keep me warm and Nothin' else, nothin' more important Makes me wanna believe in love (Mmm) I love the thought of us in the evening Crave the feeling The way you feel, somethin' 'bout it's healing I'm praying we don't fuck this up (Ah-ah-ah, babe)  Others that I've had had to impress me before But I knew you were the real thing When you walked through the door I didn't think that I would have to spell it out  Don't put the bands, put the bands on me Oh, my love, oh, my love is free Ain't no price on my loyalty No shit, got me right where you want me, baby Could I be more obvious? (Ooh) Hard to think when I'm under you Tell you all of my dirty truths No shit, got me right where you want me, baby Could I be more obvious?  Maybe if I'm lucky, you might stay the afternoon If you gotta work, just promise me you'll come back soon Maybe you should pack a suitcase too (Too) I love the thought of you never leavin' (No) Days repeatin' Gettin' steps up on the treadmill while you sleepin' Never thought I'd believe in love again  Others that I've had had to impress me before (Ooh) But I knew you were the real thing When you walked through the door I didn't think that I would have to spell it out  Don't put the bands, put the bands on me Oh, my love, oh, my love is free Ain't no price on my loyalty No shit, got me right where you want me, baby Could I be more obvious? (Ooh) Hard to think when I'm under you Tell you all of my dirty truths No shit, got me right where you want me, baby Could I be more obvious? (Obvious)",1566,315,en,0.9999959757214524
89,9746,Ariana Grande,Ariana Grande,Shut Up,1,47,"My presence sweet and my aura bright Diamonds good for my appetite Guess it fuckin' just clicked one night All them demons helped me see shit differently So don't be sad for me  How you been spending your time? (How?) How you be using your tongue? (How?) You be so worried 'bout mine (Mine) Can't even get yourself none You know you sound so dumb (So dumb, so dumb) You know you sound so dumb (So dumb)  So maybe you should shut up, mmm Yeah, maybe you should shut up Said if only you would shut up (Mmm) Yeah, that's right, you should shut up (Ah)  I vibrate high and my circle lit We ain't really with drugs and shit Love the game so I ain't nevеr miss Keep opinions muted for the hell of it 'Causе I like my shit (Mmm, yep)  How you been spending your time? (How?) How you be using your tongue? (How?) You be so worried 'bout mine (Mine) Can't even get yourself none You know you sound so dumb (So dumb, so dumb) You know you sound so dumb (So dumb)  So maybe you should shut up, mmm Yeah, maybe you should shut up Said if only you would shut up (Mmm) Yeah, that's right, you should shut up (Ah)",1098,216,en,0.9999987277174085
91,0,Ariana Grande,Ariana Grande,"Thank U, Next",28,1,!Error!,7,1,de,0.8571394318177784
92,9770,Ariana Grande,Ariana Grande,West Side,1,71,"I don't wanna think too much I just wanna feel You know that it ain't no rush Let me keep it real Just let me be in your life like that In your life like that I'll bring the light right back I'll bring the life right back  I'm gonna make you want more (More) I'm gonna be your new favorite Tell 'em you closing the door I am the only for sure Oh, babe  Hold up, there shouldn't be no hold up There's more love if you follow emotions Show up, now if you're down to roll up Meet me on the west side for me Hold up, there shouldn't be no hold up There's more love if you follow emotions Show up, now if you're down to roll up Meet me  I don't want it if it ain't your touch It's better every time we chill You ain't gotta bring no stuff We got all we need right here Just let me be in your life like that Be your wife like that I'll bring the light right back I'll bring the life right back  I'm gonna make you want more (More) I'm gonna be your new favorite Tell 'em you closing the door I am the only for sure, baby Oh, babe, yeah  Hold up, there shouldn't be no hold up (Hold up) There's more love if you follow emotions (Emotions) Show up, now if you're down to roll up (Roll up) Meet me on the west side for me Hold up, there shouldn't be no hold up There's more love if you follow emotions Show up, now if you're down to roll up Meet me on the west side for me  Mmm",1368,286,en,0.9999978491147354
104,7692,Ashley McBryde,Ashley McBryde,One Night Standards,15,76,"I ain't gonna stay for the weekend I ain't gonna jump off the deep end I ain't gonna ask where your ring is Thing is, we all got secrets  You don't wanna hear about my last break up I don't wanna worry 'bout space you take up I don't even care if you're here when I wake up  It's just a room key You ain't gotta lie to me Can't you just use me like I'm using you? How it goes is, bar closes There's no king bed covered in roses Just a room without a view I don't want a number you ain't gonna answer Let's just stick to the one night standards  Well, I ain't Cinderella, but who is? Call me what you want if the shoe fits I ain't gonna say I never do this 'Cause truth is, lonely makes a heart ruthless  Ain't nobody gonna hurt nobody Ain't nothing wrong with needing somebody You can leave all that Down in the lobby  It's just a room key You ain't gotta lie to me Can't you just use me like I'm using you? How it goes is, bar closes There's no king bed covered in roses Just a room without a view No, I don't want a number you ain't gonna answer Let's just stick to the one night standards  How it goes is, bar closes There's no king bed covered in roses Just a room without a view No, I don't give a damn about the morning after Bottles on the floor don't even matter I don't want a number you ain't gonna answer Let's just stick to the one night standards The one night standards The one night standards",1407,284,en,0.9999970330384546
105,8572,Ava Max,Ava Max,Kings & Queens,20,13,"If all of the kings had their queens on the throne We would pop champagne and raise a toast To all of the queens who are fighting alone Baby, you're not dancing on your own  Can't live without me, you wanna, but you can't, nah-nah-nah Think it's funny, but honey, can't run this show on your own I can feel my body shake, there's only so much I can take I'll show you how a real queen behaves (Oh)  No damsel in distress, don't need to save me Once I start breathing fire, you can't tame me And you might think I'm weak without a sword But if I had one, it'd be bigger than yours  If all of the kings had their queens on the throne We would pop champagne and raise a toast To all of the queens who are fighting alone Baby, you're not dancing on your own  Disobey me, then baby, it's off with your head Gonna change it and make it a world you won't forget (Oh)  No damsel in distress, don't need to save me Once I start breathing fire, you can't tame me And you might think I'm weak without a sword But I'm stronger than I ever was before  If all of the kings had their queens on the throne We would pop champagne and raise a toast To all of the queens who are fighting alone Baby, you're not dancing on your own  In chess, a king can move one space at a time But queens are free to go wherever they like You get too close, you'll get a royalty high So breathe it in to feel alive  If all of the kings had their queens on the throne We would pop champagne and raise a toast To all of the queens who are fighting alone Baby, you're not dancing on your own  Oh-oh-oh-oh-oh-oh, oh-oh Oh-oh-oh-oh-oh-oh, oh-oh",1604,317,en,0.9999969754033546
108,2482,Avicii,Avicii,Heaven,1,83,"Step out into the dawn You pray 'til, you pray 'til the lights come on And then you feel like you've just been born Yeah, you come to raise me up When I'm beaten and broken up And now I'm back in the arms I love  And I think I just died I think I just died Yeah, I think I just died I think I just died  And went to Heaven And went to Heaven, whoa  Beaten and bathed in blood I'm hit by, I'm hit by your love and drug And now you've c-come to raise me up  And I think I just died I think I just died Yeah, I think I just died  And went to Heaven And went to Heaven Whoa, and went to Heaven  Ooh, oh  It's such a night, such a beautiful night It's such a view, such a beautiful sight I think I just, oh, I think I just died, oh  And went to Heaven And went to Heaven Oh, yeah, yeah  We're gonna be birds and fly We're gonna set the world alight We're gonna lose ourselves tonight, whoa We're gonna be birds and fly We're gonna set the world alight We're gonna lose ourselves tonight, oh In Heaven (Heaven)",1004,209,en,0.999997816755585
109,1667,Avicii Featuring Aloe Blacc,Avicii,SOS,4,68,"Can you hear me? S.O.S. Help me put my mind to rest Two times clean again, I'm actin' low A pound of weed and a bag of blow  I can feel your love pullin' me up from the underground, and I don't need my drugs, we could be more than just part-time lovers I can feel your touch pickin' me up from the underground, and I don't need my drugs, we could be more than just part-time lovers  We could be more than just part-time lovers We could be more than just part-time lovers  I get robbed of all my sleep As my thoughts begin to bleed I'd let go, but I don't know how Yeah, I don't know how, but I need you now  I can feel your love pullin' me up from the underground, and I don't need my drugs, we could be more than just part-time lovers I can feel your touch pickin' me up from the underground, and I don't need my drugs, we could be more than just part-time lovers I can feel your touch pickin' me up from the underground, and I don't need my drugs, we could be more than just part-time lovers  (We could be) We could be more than just part-time lovers (Part-time lovers, yeah) (More than, more than lovers) We could be more than just part-time lovers  Can you hear me? S.O.S. Help me put my mind to rest",1204,239,en,0.9999949660912693
117,10012,BTS,BTS,Blue & Grey,1,13,"Where is my angel? 하루의 끝을 드리운 Someone come and save me, please 지친 하루의 한숨뿐 사람들은 다 행복한가 봐 Can you look at me? 'Cause I am blue and grey 거울에 비친 눈물의 의미는 웃음에 감춰진 나의 색깔 blue and grey  어디서부터 잘못됐는지 잘 모르겠어 나 어려서부터 머릿속엔 파란색 물음표 어쩜 그래서 치열하게 살았는지 모르지 But 뒤를 돌아보니 여기 우두커니 서니 나를 집어삼켜버리는 저 서슬 퍼런 그림자 여전히도 파란색 물음표는 과연 불안인지 우울인지 어쩜 정말 후회의 동물인지 아니면은 외로움이 낳은 나일지 여전히 모르겠어 서슬 퍼런 블루 잠식되지 않길 바래 찾을 거야 출구  I just wanna be happier 차가운 날 녹여줘 수없이 내민 나의 손 색깔 없는 메아리 Oh this ground feels so heavier I am singing by myself I just wanna be happier 이것도 큰 욕심일까  추운 겨울 거리를 걸을 때 느낀 빨라진 심장의 호흡 소릴 지금도 느끼곤 해 괜찮다고 하지 마 괜찮지 않으니까 제발 혼자 두지 말아 줘 너무 아파  늘 걷는 길과 늘 받는 빛 But 오늘은 왠지 낯선 scene 무뎌진 걸까 무너진 걸까 근데 무겁긴 하다 이 쇳덩인 다가오는 회색 코뿔소 초점 없이 난 덩그러니 서있어 나답지 않아 이 순간 그냥 무섭지가 않아 난 확신이란 신 따위 안 믿어 색채 같은 말은 간지러워 넓은 회색지대가 편해 여기 수억 가지 표정의 grey 비가 오면 내 세상 이 도시 위로 춤춘다 맑은 날엔 안개를 젖은 날엔 함께 늘 여기 모든 먼지들 위해 축배를  I just wanna be happier 내 손의 온길 느껴줘 따뜻하지가 않아서 네가 더욱 필요해 Oh this ground feels so heavier I am singing by myself 먼 훗날 내가 웃게 되면 말할게 그랬었다고  허공에 떠도는 말을 몰래 주워 담고 나니 이제 새벽잠이 드네 good night",1032,269,ko,0.9999996047674719
120,6186,BTS,BTS,Filter,1,87,"너의 따분한 그 표정 지루한 발끝 Please, look at me now 핸드폰은 내려놔 고개 돌릴 생각도 마 Let me know your type 날 골라 쓰면 돼 yeah  Oh, 너의 눈을 나의 손으로 포개 Oh, 다가가 비밀에 널 데려갈게 완전히 새로운 세상에 Yeah, 네 감은 눈을 떠봐 이제 go  팔레트 속 색을 섞어 pick your filter 어떤 나를 원해? 너의 세상을 변화시킬 I’m your filter 네 맘에 씌워줘  (Okay) 어때 조금 느낌이 와? 아직 모자라? (Yes) Girl, you have your chance I can be your Genie How ‘bout Aladdin? 뭐든 돼 줄게 날 골라 쓰면 돼 yeah  Oh, 네 꿈처럼 널 감싸 안을 거야 Oh, 은밀한 spec이야 난 너를 위해 매일 새로울 거야 늘 똑같은 건 재미없잖아  팔레트 속 색을 섞어 pick your filter 어떤 나를 원해? 너의 세상을 변화시킬 I’m your filter 네 맘에 씌워줘  불현듯 아이로 변한 날 봐 볼수록 귀여워 미치도록 (미치도록) 취향도 기준도 뛰어넘어 넌 오직 나만을 원하게 돼 Yeah, 날 만든 사람 바로 너니까  난 여태 네가 본 적 없는 brand new filter 내게 널 맡겨봐 더 짜릿한 걸 볼 수 있게 pick your filter 나만을 담아봐  Na-na-na-na-na-na-na-na-na Pick your filter 나만을 담아봐 Na-na-na-na-na-na-na-na-na I’m your filter 내게 널 맡겨봐  새로운 우리가 될 거야 Ayy, 날 네 맘에 씌워줘",823,203,ko,0.42857149862784233
122,10000,BTS,BTS,Life Goes On,3,1,"어느 날 세상이 멈췄어 아무런 예고도 하나 없이 봄은 기다림을 몰라서 눈치 없이 와버렸어 발자국이 지워진 거리 여기 넘어져있는 나 혼자 가네 시간이 미안해 말도 없이, yeah  오늘도 비가 내릴 것 같아 흠뻑 젖어버렸네 아직도 멈추질 않아 저 먹구름보다 빨리 달려가 그럼 될 줄 알았는데 나 겨우 사람인가 봐 몹시 아프네 세상이란 놈이 준 감기 덕분에 눌러보는 먼지 쌓인 되감기 넘어진 채 청하는 엇박자의 춤 겨울이 오면 내쉬자 더 뜨거운 숨  끝이 보이지 않아 출구가 있긴 할까? 발이 떼지질 않아 않아, oh 잠시 두 눈을 감아 여기 내 손을 잡아 저 미래로 달아나자  Like an echo in the forest 하루가 돌아오겠지 아무 일도 없단 듯이 Yeah, life goes on Like an arrow in the blue sky 또 하루 더 날아가지 On my pillow, on my table Yeah, life goes on Like this again  이 음악을 빌려 너에게 나 전할게 (Ayy) 사람들은 말해 세상이 다 변했대 (No) Mm-mm-mm-mm 다행히도 우리 사이는 아직 여태 안 변했네  늘 하던 시작과 끝 ""안녕"" 이란 말로 오늘과 내일을 또 함께 이어보자고 (Ooh, ooh, ooh, oh-woah) 멈춰있지만 어둠에 숨지 마 빛은 또 떠오르니깐  끝이 보이지 않아 출구가 있긴 할까? 발이 떼지질 않아 않아 oh 잠시 두 눈을 감아 (감아) 여기 내 손을 잡아 (잡아) 저 미래로 달아나자 (Oh, oh, oh)  Like an echo in the forest 하루가 돌아오겠지 아무 일도 없단 듯이 Yeah, life goes on (Oh, woah) Like an arrow in the blue sky 또 하루 더 날아가지 (날아가지) On my pillow, on my table Yeah, life goes on Like this again  I remember I, yeah-yeah-yeah-yeah I remember Ah-ah, ah-ah I remember I, yeah-yeah-yeah-yeah I remember Ah-ah, ah-ah",1071,263,ko,0.5714275603376604
