,id,artist,first_artist,song,weeks_on_chart,peak_rank,lyrics,length,word_count,language,language_score
635,43,Kelly Clarkson,Kelly Clarkson,Underneath The Tree,9,12,"You're here where you should be Snow is falling as the carolers sing It just wasn't the same Alone on Christmas day Presents, what a beautiful sight Don't mean a thing if you ain't holding me tight You're all that I need Underneath the tree  Tonight, I'm gonna hold you close Make sure that you know I was lost before you Christmas was cold and grey Another holiday Alone to celebrate  But then, one day, everything changed You're all I need Underneath the tree  You're here where you should be Snow is falling as the carolers sing It just wasn't the same Alone on Christmas day Presents, what a beautiful sight Don't mean a thing if you ain't holding me tight You're all that I need Underneath the tree  I found what I was looking for A love that's meant for me A heart that's mine completely Knocked me right off my feet And this year I will fall With no worries at all  'Cause you are near and everything's clear You're all I need Underneath the tree  You're here where you should be Snow is falling as the carolers sing It just wasn't the same Alone on Christmas day Presents, what a beautiful sight Don't mean a thing if you ain't holding me tight You're all that I need Underneath the tree   And then one day everything changed You're all I need Underneath the tree, yeah  You're here where you should be Snow is falling as the carolers sing (Oh, yeah, yeah) It just wasn't the same (Oh, yeah, yeah, yeah) Alone on Christmas day Presents, what a beautiful sight (Oh, you're all I need) Don't mean a thing if you ain't holding me tight (Underneath the tree) You're all that I need (Underneath the tree, yeah) Underneath the tree, tonight Oh, you're all I need Underneath, underneath the tree",1696,311,en,0.9999965450573801
637,9494,Kelsea Ballerini,Kelsea Ballerini,Hole In The Bottle,10,72,"There are many people who drink in moderation with no problems Social, moral, or medical They have learned to enjoy liquor without letting it upset The functioning of their body and mind It relaxes you, makes you more congenial (I just had one sip) This helps make a gathering cheerful and friendly  It ain't my fault, so don't blame me I swear I just came here to unwind and have one drink The way it looks, it ain't what you think This Cabernet has a way of vanishing on me  There's a hole in the bottle leaking all this wine It's already empty and it ain't even supper time Honey, no, I don't miss him In fact, it slipped my mind There's a hole in the bottle of wine  I keep my cool, play by all the rules I swear ten minutes ago that bottle was full But I won't cry about love gone wrong 'Cause tears would water down this ruby red I'm sipping on  There's a hole in the bottle leaking all this wine It's already empty and it ain't even supper time Honey, no, I don't miss him In fact, it slipped my mind There's a hole in the bottle of wine (Aw, yeah)  I went and got a new one 'Cause the other one was broken Now this one's halfway gone And it's barely even open  There's a hole in the bottle (Hole in the bottle) leaking all this wine It's already empty and it ain't even supper time Honey, no, I don't miss him In fact, it slipped my mind There's a hole in the bottle of wine  You may ask me where it's going But I can't even find The hole in the bottle of wine She has abused her system, and she's paying for it",1519,302,en,0.9999982276677922
639,3781,Kelsea Ballerini,Kelsea Ballerini,homecoming queen?,13,65,"Hey, homecoming queen Why do you lie? When somebody's mean Where do you hide? Do people assume You're always alright? Been so good at smiling Most of your life  Look damn good in the dress Zipping up the mess Dancing with your best foot forward Does it get hard To have to play the part? Nobody's feeling sorry for ya  But what if I told you the world wouldn't end If you started showing what's under your skin? What if you let 'em all in on the lie? Even the homecoming queen cries Oh  Hey, homecoming queen How's things at home? Still walking on eggshells When that curtain's closed? Did your Daddy teach you How to act tough? Or more like your Mama Sweep it under the rug?  Look damn good in the dress Zipping up the mess Dancing with your best foot forward Did you want the crown? Or does it weigh you down? Nobody's feeling sorry for ya  What if I told you the world wouldn't end If you started showing what's under your skin? What if you let 'em all in on the lie? Even the homecoming queen cries Yeah, what if I told you the sky wouldn't fall? If you lost your composure, said to hell with it all Not everything pretty sparkles and shines And even the homecoming queen cries (Ooh) Oh yeah (Ooh) Even the homecoming queen cries (Ooh) Mmm-mmm, mmm (Ooh)  Hey, homecoming queen Why do you lie? When somebody's mean Where do you hide?",1337,252,en,0.9999986732455005
641,9584,Kenny Chesney,Kenny Chesney,Happy Does,6,85,"Ol' Sunoco Charlie drives an '87 Harley Sells gasoline and what you drink 8 to 3 AM Got a tattoo for the Corps and ex wife number four Hummin' along, schoolin' you on the songs on his station He could be another one cussin' the government, nah, but he smiles Got hundred reasons not to, but he's the poster child for  Happy is as happy does Grab a six string, find a rope swing Hang a palm tree in your truck Drink a beer just because Steal a slow dance in a rain storm And a kiss from who you love Laugh and live with a half-full cup Yeah, happy is as happy does  Some find it in the scripture or a Polaroid picture Or flip a coin, heads, you're goin' to Tucson, Arizona But it damn sure ain't in the lookin' back on the stuff you never did Sometimes, you're gonna feel that, but life is better when  Happy is as happy does Grab a six string, find a rope swing Hang a palm tree in your truck Drink a beer just because Steal a slow dance in a rain storm And a kiss from who you love Laugh and live with a half-full cup 'Cause happy is as happy does  She's a long way from the old her In this mountain dive in Boulder Every pickle jar, crinkled dollar Takes her another mile high  Happy is as happy does Grab a six string, find a rope swing Hang a palm tree in your truck Drink a beer just because Steal a slow dance in a rain storm And a kiss from who you love Laugh and live with a half-full cup When it's all black clouds, find the sun 'Cause happy is as happy does  Happy is as happy does Laugh and live with a half-full cup",1527,309,en,0.9999975474588016
642,6792,Kenny Chesney,Kenny Chesney,Here And Now,15,38,"Seen the skyline of New York City Fireflies in Tennessee Sipped a little shine from a paper sack that'll Knock the horns off a Cadillac I must've sat on a dozen islands Watched the sun sink into the sea Been there, done that, got the T-shirt and hat But my favorite place to be is  Here and now Nowhere else in this world enough You and me, ain't it good to be alive? Ain't no better place, ain't no better time Than here and now Everybody's waiting, but they're waiting on what? Better get to living 'cause all we've got is here and now  Think I fell in love for the first time With a girl from Mexico Thought I found a true love in Malibu, but That water was a little too cold Yeah, I left a few tears in the rearview One or two that were hard to forget Why you think we call the present the present? 'Cause there ain't no better gift than  Here and now Nowhere else in this world enough You and me, ain't it good to be alive? Ain't no better place, ain't no better time Than here and now Everybody's waiting, but they're waiting on what? Better get to living 'cause all we've got is here and now  A lotta people dreaming 'bout one-day-some-days Waiting just around the bend (Waiting just around the bend) I used to be one wonderin' when they'd come But now I'm livin' in (But now I'm livin' in) Here and now Yeah, I'm livin' in the  Here and now Nowhere else in this world enough You and me, ain't it good to be alive? Ain't no better place, ain't no better time Than here and now Everybody's waiting, but they're waiting on what? Better get to living 'cause all we've got is here and now",1591,308,en,0.9999948268658123
643,2982,Kenny Chesney,Kenny Chesney,Tip Of My Tongue,20,73,"I love the dimples in the small of your back The way they're speaking to me just like that Red wine made my imagination run Oh, I can taste it on the tip of my tongue  Let it run, let it roll Baby, I am under your control Love me fast, kiss me slow Hang on to anything you can hold  It's a long way down To where I wanna go It's a long way down To the center of your soul It's a long way down And I'm a loaded gun But I love your salt and sugar on the tip of my tongue  Girl, believe me when I say it's true Nobody makes me feel the way you do Well, I love you from the morning 'til the setting sun, yeah I can taste the ocean on the tip of my tongue  Let it run, let it roll Baby, I am under your control Love me fast, kiss me slow Hang onto anything you can hold  It's a long way down To where I wanna go It's a long way down To the center of your soul It's a long way down And I'm a loaded gun But I love your salt and sugar on the tip of my tongue Yeah, I love your salt and sugar on the tip of my tongue  It's a long way down It's a long way down  It's a long way down And I'm a loaded gun But I love your salt and sugar on the tip of my tongue Yeah, I love your salt and sugar on the tip of my tongue  I wanna love you 'til my days are done I wanna tell you that I think that you're the one Oh girl, you know when it's all said and done Everything about you's on the tip of my tongue",1389,310,en,0.9999985353386025
648,1176,Khalid,Khalid,My Bad,3,55,"Can't count up the times you've blown my line And that's been on my mind a lot lately I wanna leave the extra all behind, mmm And I know that you wanna be my baby, mmm yeah  Said, my bad Blowin' me up, you've been wildin' We was cool, yeah, we was vibin' Gotta put my phone on silent So my, my, my, my bad Blowin' me up, you've been wildin' We were cool, yeah, we was vibin' Gotta put my phone on silent So my, my, my bad  Oh, we both care about it But arguing with me just isn't worth it No, no, no Don't go reachin' in your bag, your bag, yeah I didn't text you back 'cause I was workin' Ah, yeah  Said, my bad Blowin' me up, you've been wildin' We was cool, yeah, we was vibin' Gotta put my phone on silent So my, my, my, my bad Blowin' me up, you've been wildin' We were cool, yeah, we was vibin' Gotta put my phone on silent So my, my, my bad  Gave you all the signs Gave you all of my time, my love You're followin' the signs But you're followin' the wrong signs, my love Gave you all the signs Gave you all of my time, my love (Gave you all my time and all my love) You're followin' the signs But you're followin' the wrong signs, my love  Said, my bad Blowin' me up, you've been wildin' We was cool, yeah, we was vibin' (Vibin') Gotta put my phone on silent (On silent) So my, my, my, my bad (My bad) Blowin' me up, you've been wildin' (Blowin' me up) We were cool, yeah, we was vibin' Gotta put my phone on silent So my, my, my bad  Oh my, my, my Oh my, my, my My bad, my bad Alright",1492,310,en,0.9999971922833267
649,743,Khalid,Khalid,Talk,46,3,"Can we just talk? Can we just talk? Talk about where we're goin' Before we get lost, lend me your thoughts Can't get what we want without knowin' I've never felt like this before I apologize if I'm movin' too far Can we just talk? Can we just talk? Figure out where we're goin'  Yeah, started off right I can see it in your eyes I can tell that you're wantin' more What's been on your mind? There's no reason we should hide Tell me somethin' I ain't heard before  Oh, I've been dreamin' 'bout it And it's you I'm on So stop thinkin' 'bout it  Can we just talk? Can we just talk? Talk about where we're goin' Before we get lost, lend me your thoughts (Yeah) Can't get what we want without knowin' (No) I've never felt like this before I apologize if I'm movin' too far Can we just talk? Can we just talk? Figure out where we're goin'  Oh, nah Penthouse view, left some flowers in the room I'll make sure I leave the door unlocked Now I'm on the way, swear I won't be late I'll be there by five o'clock  Oh, you've been dreamin' 'bout it And I'm what you want So stop thinkin' 'bout it  Can we just talk? (Oh) Can we just talk? Talk about where we're goin' Before we get lost, lend me your thoughts Can't get what we want without knowin' I've never felt like this before I apologize if I'm movin' too far Can we just talk? Can we just talk? Figure out where we're goin'  Figure out where we're goin'",1397,272,en,0.9999969275131799
650,4788,Khalid,Khalid,Up All Night,1,89,"Take me 'round the world and back again As I'm searching for my soul out there Oh, there's something that I'm wondering (Yeah) Where I'm going when my story ends  Doesn't even matter anyway, no, we're Focused and I'm coping with the pain, yeah, we're Only getting older by the day, yeah, we're Only getting older (Only getting older) Doesn't even matter anyway, no, we're Focused and I'm coping with the pain, yeah, we're Only getting older by the day, yeah, we're Only getting older (On my mind all the time)  Keeps me up all night Keeps me Get these thoughts that keep me up all night Keeps me Keeps me up all night Keeps me Get these thoughts that keep me up all night Keeps me  So I'ma light it up, I'm gettin high (So high) Ask me how I am, I'm getting by (Getting by by the minute) But I'm thankful that I'm still alive (Alive) 'Cause there's so much more I'm left to find  Doesn't even matter anyway, no, we're Focused and I'm coping with the pain, yeah, we're Only getting older by the day, yeah, we're Only getting older (Only getting older) Doesn't even matter anyway, no, we're Focused and I'm coping with the pain, yeah, we're Only getting older by the day, yeah, we're Only getting older (On my mind all the time)  Keeps me up all night Keeps me Get these thoughts that keep me up all night Keeps me up (Up all night) Keeps me up all night Keeps me (Up) Get these thoughts that keep me up all night Keeps me up (Up all night)  On my mind all the time Keepin' me up all night On my mind all the time Keepin' me up all night On my mind all the time, ah  Keeps me up all night Keeps me",1595,309,en,0.9999965522012664
655,5956,Khalid x Disclosure,Khalid,Know Your Worth,8,57,"He keeps leaving you for dead I don't know what you been waiting for So you've got your love locked up instead But somethin' better's waitin' at your door  You don't know your worth All the things I know that you deserve Say it's not real if it doesn't hurt Find someone you know will put you first Find someone who loves you at your worst  Gotta keep, gotta keep, gotta keep your head up Gotta keep, gotta keep, gotta keep your head up Gotta keep, gotta keep, gotta keep your head up Who puts you first? Find someone who loves you at your worst  Don't forget the words I said Picking you up when you're feelin' down You get strung on thoughts left in your head When you lose hope, soon you will be found  You don't know your worth All the things I know that you deserve Say it's not real if it doesn't hurt Find someone you know will put you first Find someone who loves you at your worst  Gotta keep, gotta keep, gotta keep your head up Gotta keep, gotta keep, gotta keep your head up Gotta keep, gotta keep, gotta keep your head up Who puts you first? Find someone who loves you at your worst  (Find someone who loves you at your worst) Find someone who loves you at your worst  Gotta keep, gotta keep, gotta keep your head up (Head) Gotta keep, gotta keep, gotta keep your head up (Keep your head up, keep your head up) Gotta keep, gotta keep, gotta keep your head up Who puts you first? Find someone who loves you at your worst  (Find someone who loves you at your worst) Find someone who loves you at your worst",1517,292,en,0.999996516979758
656,1583,Khalid x SAFE,Khalid,Don't Pretend,1,84,"I feel like I'm losing you whenever I'm offline Though I never had you, I used to pretend that you're mine I feel like there's nothing for me here, but still, I try I feel like there's nothing for me here, but still, I try Bruising my finger hitting your line If I'm holding back, I might just lose my mind (So alone)  Keeping my phone alive (Alive) Hoping that you call this time (Oh, I) Thought I heard your ringing (You) You know I hear things sometimes Call my line, call my line Come alive, come alive Show me, don't pretend Show me, don't pretend Show me, don't pretend  Keepin' you on my radar Lately, you're so damn cold You used to hold me down You're far, so it's been a while I still remember your voice How you talk so soft in the morning You're the only one I'm wanting Love stays still and I'm frozen But I'm opening thoughts that I keep within I guess I gotta be a man I tried as hard as I can  Keeping my phone alive (You) Hoping that you call this time Thought I heard you ringin' You know I hear things sometimes Call my line, call my line Come alive, come alive Show me, don't pretend Show me, don't pretend Show me, don't pretend Show me, don't pretend Show me, don't pretend (Come alive, oh yeah) Show me, don't pretend (Yeah, yeah) Show me, don't pretend",1276,246,en,0.9999946823060614
658,10399,Kid Cudi,Kid Cudi,Beautiful Trip,1,100,"Oh, oh Oh Three (Three, two, one)",33,7,en,0.9999974778068292
660,10379,Kid Cudi,Kid Cudi,Dive,1,80,"Hey  Seen nothing like that shorty with the fat back movin' to the vibes (Vibes) Say, ""I'm just up in my habitat, playin' little Ratatat, kickin' with my tribe"" (Ride) I'm sayin' it's a known fact, show 'em, nigga, no act, sucker, fall in line (Yeah) I'm out to get mine, woah, woah, niggas seein' me shine (Ride) Catch me baked outside, wonderin' daily, why, why? Will she let me get behind? Baby, just close your eyes (Eyes) You see we takin' off, leave the stress, no time (Bye) This ain't televised, see I'm her surprise, I  Ooh-ooh, ooh, that vibe Ooh-ooh, ooh, that vibe Ooh-ooh, I need those fuckin' vibes Doo-doo-doo-doo, and we ragin' 'til daylight Things are gettin' gnarly, got my whiskey by my side Soarin' through my world and I'm 'bout to take a dive This is just the sadness in me, sad times Just another evening and I'm leanin', oh (Let's get it)  Uh, ready, go, set, we won't hold you, neither (Uh) Salute when you see that nigga (Yeah) Tell him, ""Go off,"" when you see him, greet him (Mm) Talkin' shit, fuck ya, legend of the cold one, nice This my life, all my nights Walkin' like a disco ball, all this ice, aye Ayy, ayy, ayy, ayy (This the story) Ayy, ayy, ayy (Woo), ayy (Of a man) Ayy, ayy, ayy (Woo), ayy (And you know it) Ayy, ayy, ayy (Move, move), ayy (Catch the show) Slightly paranoid, can't believe 'em simply (Yeah) Nah, bullshit, miss me (Nah, nah), ahh Call it what it is then, lies This my fantasy high, sayin' goodbye I lay at night, it intensifies",1483,276,en,0.9999956881936729
663,10389,Kid Cudi,Kid Cudi,Sad People,1,90,"Mm-mm, yeah Mm-mm  In the dead of the night, I have these dreams What'll happen to me? Will I burn out? Have I been wrong? What does it mean? All these things, can't understand why Say something's wrong with me, I know By myself alone driving, I go Full moon as it glows, I search for truth Tryna be brand new, yeah, I will try No, I won't do but through these screams Fighting and bleed, blood in my eye And I'll be (Another broken soul) God save me (Yeah)  Yeah, baby, see I'm back in my zone Just what I need, mama (Yeah) Nigga been in hell, the same ol' On a mission and I'm gonna fly high (High) This for the sad pеople who keep the blunt burning and we Off on a journеy, you learn me  Close call, life on the edge Ahh, when the time comes, I'll find peace Still in search of, nights, I'm sittin' wishin' I can find love in me Lettin' go, ooh, this ain't livin' I swim in pain Never drown, keep my head up above the waves (Get it, get it) Tired of runnin', I won't run from fate Late night, ooh, this is when I come alive, when the dreams made Take me, ooh, just don't leave, babe Come on, woah (Don't say goodnight) Scars on my heart, woah (Ahh, ahh, ahh, yeah)  Yeah, baby, see I'm back in my zone Just what I need, mama (Yeah) Nigga been in hell, the same ol' On a mission and I'm gonna fly high (High) This for the sad people who keep the blunt burning and we Off on a journey, you learn me",1399,282,en,0.9999967481958112
673,95,Kip Moore,Kip Moore,Last Shot,8,53,"Well, baby love's just one of them words that gets thrown around Like a Jack and Coke, sitting on the bar, it gets watered down So I ain't gonna say it, no I ain't gonna lie If you want to known the truth, how I feel about you tonight  If you were my last breath, I'd just wanna hold ya If you were my last night I ever had on wheels, I woulda drive you like I stole ya If you were my last shot, last shot of whiskey I'd press you to my lips, take a little sip Swirl you around and around and around Then I'd shoot ya down  So baby let me look at you and see just what I got If you were my cherry stem I'd tie you in a knot And if I could inhale you, oh baby I'd be gone I'd be floating round high as the Colorado sky blowing smoke rings all night long  If you were my last breath, I'd just wanna hold ya If you were my last night I ever had on wheels, I woulda drive you like I stole ya If you were my last shot, last shot of whiskey I'd press you to my lips, take a little sip Swirl you around and around and around Then I'd shoot ya down Last call, last chance Last dance I was ever gonna get to take  If you were my last breath, I'd just wanna hold ya If you were my last night I ever had on wheels, I woulda drive you like I stole ya If you were my last shot, last shot of whiskey I'd press you to my lips, take a little sip Swirl you around and around and around Then I'd shoot ya down Then I'd shoot ya down  If you were my last breath, I'd just wanna hold ya",1466,315,en,0.9999970663099335
680,2185,Lady Antebellum,Lady Antebellum,What If I Never Get Over You,21,40,"It's supposed to hurt, it's a broken heart But to movin' on is the hardest part It comes in waves, the letting go But the memory fades, everybody knows Everybody knows  What if I'm tryin', but then I close my eyes And then I'm right back, lost in that last goodbye? And what if time doesn't do what it's supposed to do? What if I never get over you?  Maybe months go by, maybe years from now And I meet someone and it's workin' out Every now and then, he can see right through 'Cause when I look at him Yeah, all I  see is you  What if I'm tryin', but then I close my eyes And then I'm right back, lost in that last goodbye? And what if time doesn't do what it's supposed to do? What if I never get over you?  Ooh yeah What if I never get over? What if I never get closure? What if I never get back all the wasted words I told ya? What if It never gets better? What if this lasts forever and ever and ever?  I'm tryin', but then I close my eyes And then I'm right back, lost in that last goodbye And what if time doesn't do what it's supposed to do? What if I never get over you? What if I gave you (What if I gave you) everything I got? What if your love was my one and only shot? What if I end up with nothing to compare it to What if I never get over? Oh, if I never get over What if I never get over you?  What if I never get over you? Oh, what if I never get over? Over you",1378,291,en,0.9999951473454674
681,7583,Lady Gaga,Lady Gaga,Alice,1,84,"My name isn't Alice But I'll keep looking, I'll keep looking for Wonderland My name isn't Alice But I'll keep looking, I'll keep looking for Wonderland, Wonderland Ah, ah, ah, oh, ah, ah, ah (Ah) Set me free (Ah-ah-ah) Ah, ah, ah, oh, ah, ah, ah (Ah) Set me free (Ah-ah-ah)  Could you pull me out of this alive? (Ah, ah, ah, oh, ah, ah, ah) Where's my body? I'm stuck in my mind (Ah, ah, ah, oh, ah, ah, ah)  (Oh ma-ma-ma, oh ma-ma-ma) I'm tired of screaming (Oh-ma-ma-ma, oh-ma-ma-ma) At the top of my lungs (Oh my mother, oh my mother) I'm in the hole, I'm falling down, down So down, down  My name isn't Alice But I'll keep looking, I'll keep looking for Wonderland My name isn't Alice But I'll keep looking, I'll keep looking for Wonderland, Wonderland  Take me home Take me to Wonderland, Wonderland Take me home Take me to Wonderland, Wonderland  Sick and tired of waking up Screaming at the top of my lungs Think I might've just left myself behind Maestro, play me your symphony I will listen to anything Take me on a trip, DJ, free my mind  My name isn't Alice But I'll keep looking, I'll keep looking for Wonderland My name isn't Alice But I'll keep looking, I'll keep looking for Wonderland, Wonderland  Take me home Take me to Wonderland, Wonderland Take me home Take me to Wonderland, Wonderland Take me home Take me to Wonderland, Wonderland Take me home Take me to Wonderland, Wonderland  Ah, ah, ah, oh, ah, ah, ah, oh (Ah) Set me free (Ah-ah-ah) Ah, ah, ah, oh, ah, ah, ah, oh (Ah) Set me free (Ah-ah-ah)",1520,281,en,0.9999970809506122
