,lyrics,is_corona_song
25,"When the dogwoods start to bloom
And the crickets hum their tune
That's usually about the time
That I feel most alive
But the news has all been bad
And the whole world seems so sad
I ain't had much else going on
So I sat down and wrote this song

I miss my mom, I miss my dad
Miss the road, I miss my band
Giving hugs and shaking hands
It's a mystery, I suppose
Just how long this thing goes
But there'll be crowds and there'll be shows
And there will be light after dark
Some day when we aren't six feet apart

First thing that I'm gonna do
Slide on in some corner booth
And take the whole damn family out
Buy my buddies all a round
Pay some extra on the tab
Catch a movie, catch a cab
Watch a ball game from the stands
Probably over-wash my hands

I miss my mom, I miss my dad
Miss the road, I miss my band
Giving hugs and shaking hands
Well, it's a mystery, I suppose
Just how long this thing goes
But there'll be crowds and there'll be shows
And there will be light after dark
Some day when we aren't six feet apart

I miss my mom, I miss my dad
I miss the road, I miss my band
Giving hugs and shaking hands
Well, it's a mystery, I suppose
Just how long this thing goes
But there'll be crowds and there'll be shows
And there will be light after dark
Some day when we aren't six feet apart

There will be light after dark
Some day when we aren't six feet apart",True
26,"Yeah, yeah, yeah
I've been blind for a while now

I just got the key, they let me in, no ID
Doors openin' up for me and now I see
I've been blind for a while now
I've been blind for a while now (Ayy, I've been blind, hey)

Every single goddamn day, a nigga think he next to leak it (Next to who?)
Tomatoes, mustard, mayonnaise
Nigga better catch up, catch up, catch up, catch up (Yup, yup, yup)
Thankful that my head too hard for me to learn my lesson (My head too goddamn hard)
'Cause the way I did it worked out fine, ooh, God you blessed me (Amen)
Probably ain't believe me
Know a nigga went through hell and back, now he finally on the TV (Yeah)
Now a nigga don't even give a fuck no more, probably think it's easy
Let you know it ain't easy
I fuck her like a Bathing Ape, she run from the dick like a cheetah (Go)
Two-tone AP watch on, never see me use it for a clock (Tick, tock)
They see the way he fuckin' up the charts (Hmm)
I wonder is he ever gon' stop?
And he charge a hundred-fifty for the verses now
Pay it or he never ever drop
They noticed that a nigga music versatile
Wonder if he ever goin' pop? (Go)
I just got the key, they let me in, no ID
Doors openin' up for me and now I see
I've been blind for a while now (Blind)
I've been blind for a while now (Blind)
Let's go
I just got the key, they let me in, no ID
Doors openin' up for me and now I see
I've been blind for a while now
I've been blind for a while now

Yeah
I've been quarantined, livin' with my kiddies
Tryna teach me how to cha-cha, woah
Fucked around, left the door open
Now they know that they can't stop me
Don't place me in no cop car
Yeah, I'm off probation, so it's gas I blow
I found love in my bitch, so I don't ask no more
I can really sit back, ain't gotta pass no dough
All of my brothers get loot, I don't got ride with pistols (Yeah)
They found him dead, he dissed you (Woah)
PTDS, don't you tell me you lost me (Woo)
Fuck all the rest, none them bitches are a nominee
Go to the head whenever dogs with me die
Got me riding 'til the sun come, blood on my white 1's
I just got the key, they let me in, no ID
Doors openin' up for me and now I see
I've been blind for a while now (Blind)
Yeah, I've been blind for a while now, yeah (Let's go)
I just got the key, they let me in, no ID
Doors openin' up for me and now I see
I've been blind for a while now
I've been blind for a while now (Yeah)",True
27,"The sidewalks are empty, the bars and cafes too
The streetlights only changing
'Cause they ain't got nothing better to do
You say it's like Christmas when nobody's around
When our city was still a secret
Before those carpetbaggers came to town

And the airports and train stations are full of desperate people
Trying to convince the gate agents
That not all emergencies are equal
But no one is going anywhere soon

Inside the Safeway, it's like the Eastern Bloc
'Cause people have a way of getting crazy
When they think they'll be dead in a month
But you like the silence of the wind through the trees
And I like walking beside you
Through these days of no guarantees
And National Guard is on their way
To protect us from our neighbors
And everyone who's tried to swim for it
Has drowned out past the breakers

And the airports and train stations are full of desperate people
But no one is going anywhere soon
No one is going anywhere soon",True
28,"Tryin' to keep it together, ooh ooh
Tryin’ to keep it together, ooh ooh
Tryin' to keep it together, ooh ooh
Tryin' to keep it together, ooh ooh
Keepin’ up all the time, ooh ooh
Conversations are empty, ooh ooh
How do we really know, ooh ooh
Tryin' to keep it together, ooh ooh
I'll be quiet and you'll be quiet too
As we are, ohh
Ooh ooh
Ooh ooh
Ooh ooh
Ooh ooh
I'll be quiet, you'll be quiet too
As we are
Are quiet too
As we are, ohh
Tryin' to keep it together
Tryin' to keep it together
Tryin’ to keep it together, ooh ooh
Tryin’ to keep it together, ooh ooh
Ooh ooh
Ooh ooh
Ooh ooh",True
29,"(Sad Pony)
Watch, mhm, Glock, mhm, cocked, mhm, got it, mhm
You need that? I got it, this cash, my pockets
The 'Cat one hundred, you need that? I got it
Need it, got it, cash, pockets
Bands on me, sticks on me
You need that? I got it, this cash, my pockets
The 'Cat one hundred, you need that?

Yeah, she like how I throw them racks, yeah, yeah, yeah, yeah, yeah
Keep on throwin' that cash, yeah, yeah, yeah, yeah, yeah
Keep on throwin' that ass, yeah, yeah, yeah, yeah, yeah
Benz truck in the back, yeah, yeah, yeah, yeah, yeah

I know you don't like me, you wanna fight me
You don't want no problems at your party, don't invite me
I don't worry 'bout you niggas, please stop talking 'bout me
Always talking 'bout me 'cause you looking for the clouty
6ix-nina, the 9ine-nina
Riding in a two-seater with two ninas
Baby got that Aquafina, it's cocaina
Smoking on that OG reefer, no TMZ-a
Forgiatos on a Benz truck, make her friends fuck
Told her she could get Chanel if she let my friends fuck
Stars shining in the Rolls Royce, it got red guts
Wait, hold up, nah, I still don't give a fuck
Vroom, vroom, G5, vroom, vroom, we high
You the type of nigga that I never wanna be like
You a type of bitch that will never get a reply
Hi, hater, bye, hater, vroom
Yeah, she like how I throw them racks, yeah, yeah, yeah, yeah, yeah
Keep on throwin' that cash, yeah, yeah, yeah, yeah, yeah
Keep on throwin' that ass, yeah, yeah, yeah, yeah, yeah
Benz truck in the back, yeah, yeah, yeah, yeah, yeah

Dollar, dollar bill, come get her
Even your man know Nickis do it better
I know you don't like me, you wanna fight me
Always on my page, never double-tap like me
Baddies to my left and my right
Never chase a corny nigga, put that on my life
Just put it in his face, all this cake, he wanted a taste
We sippin' on that Ace, itty-bitty waist, pretty face
Yeah, eat it, Cookie Monster (Ooh)
He a slave to this pussy, call me master
Real wet, I said, ""Slurp it like it's pasta""
They get nervous when it's Nicki on the roster (Rrr)
Somebody usher this nigga into a clinic
My flow's still sick, I ain't talkin' a pandemic
I write my own lyrics, a lot of these bitches gimmicks
They study Nicki style, now all of them wan' mimic
Talkin' 'bout snitches when it's snitches in your camp
Never stand alone, you always itchin' for a stamp
Me, I'm still money, wrists light up like a lamp
They gon' have to send they best fighter for the champ
Racks, I got 'em, Mary, I'm poppin'
They keep hatin', but still watchin'
Check the boards, I'm still toppin'
Bustdown or plain jane, I got options
It's a bunch of mini-mes, I'm the one they mockin'
Showed you how to get a bag, now you goin' shoppin'
When I come out, all the snake bitches start plottin' (Plottin')
When I come out, it's a sweep, bitches start moppin'
Yeah, she like how I throw them racks, yeah, yeah, yeah, yeah, yeah
Keep on throwin' that cash, yeah, yeah, yeah, yeah, yeah
Keep on throwin' that ass, yeah, yeah, yeah, yeah, yeah
Benz truck in the back, yeah, yeah, yeah, yeah, yeah

Watch, mhm, Glock, mhm, cocked, mhm, got it, mhm
If he like, I throw it fast, real fast, fast, fast
He singin' my old song, yellin', ""Ass, ass, ass""
They be speedin', tryna beat me, then they crash, crash, crash
Still a hundred like the number on my dash, dash, dash

That real ass ain't keep your nigga home",True
30,"Gray November
I've been down since July
Motion capture
Put me in a bad light
I replay my footsteps on each stepping stone
Trying to find the one where I went wrong
Writing letters
Addressed to the fire

And I was catching my breath
Staring out an open window
Catching my death
And I couldn't be sure
I had a feeling so peculiar
That this pain would be for
Evermore

Hey December
Guess I'm feeling unmoored
Can't remember
What I used to fight for
I rewind thе tape, but all it does is pause
On thе very moment all was lost
Sending signals
To be double-crossed
And I was catching my breath
Barefoot in the wildest winter
Catching my death
And I couldn't be sure
I had a feeling so peculiar
That this pain would be for
Evermore
(Evermore)

Can't not think of all the cost
And the things that will be lost
Oh, can we just get a pause?
To be certain, we'll be tall again
Whether weather be the frost
Or the violence of the dog days
I'm on waves, out being tossed
Is there a line that I could just go cross?

And when I was shipwrecked (Can't think of all the cost)
I thought of you (All the things that will be lost now)
In the cracks of light (Can we just get a pause?)
I dreamed of you (To be certain we'll be tall again, if you think of all the costs)
It was real enough (Whether weather be the frost)
To get me through (Or the violence of the dog days)
(Or the violence of the dog days)
(Out on waves, being tossed)
(I'm on waves, out being tossed)
I swear (Is there a line that we can just go cross?)
You were there
And I was catching my breath
Floors of a cabin creaking under my step
And I couldn't be sure
I had a feeling so peculiar
This pain wouldn't be for
Evermore
Evermore
Evermore
This pain wouldn't be for evermore
Evermore",False
31,"Young Money!
Haha, I know you gon' do it for the ’Gram, right?
D.A. got that dope!
Yeah, hah

First things first, I fuck, get all the money
Bitches love me, keep it hunnid (Ha)
Bitches like you 'cause you funny, niggas ain't stunners (No)
I’m the one that came and fuck the summer (Me)
I got a black Barbie, she into ménages (Yeah)
I'ma fuck her all night 'til I cum nothing (No)
Sip got me buzzin' (Yeah), I am not a husband (No)
I can be your daddy 'cause I am a motherfucker (Haha)
Fuck, niggas muggin', these niggas sweet muffin
Put my seed on her face, she get smashed like a pumpkin (Smash)
Ooh, she love it, do me rougher
Talk that nasty, when I smack your ass cheek (Come, come, come)

Can you make it dip, make it dip, make it dip
Make it dip, make it dip, make it dip, make it dip?
Here, baby, take a sip, take a sip
Take a sip, take a sip, lick your lips, lick your lips
Yeah, baby, I just wanna see you dip, see you dip, make it dip
Make it dip, make it dip, make it dip, make it dip (Ayy, ayy)
Yeah, baby, take a sip, take a sip, take a sip
Take a sip, take a sip, take a sip
Yeah, baby, show me how you make it dip
Uh, ayo
I think he wanna dippy the tippy, then put it on my lippy
Even when it get sticky, he know it still got the drippy
Yeah I'm pulling your card though, got him calling me Ricky (Aha)
All these bitches my minis, got 'em calling me Mickey (Haha!)
All that rah-rah never was the icon issue
Harper’s Bazaar, I’m covering the icon issue
I got issues, yeah bitch, I got issues
W, Vogue, Cosmo—I got issues
I always pull up with some Barbie dolls, thick in the thighs
I said we looking for some brain, where the Wizard of Oz
Last nigga was a dope dealer, hell of a guy
He said the pussy top… five, dead or alive

Can you make it dip, make it dip, make it dip
Make it dip, make it dip, make it dip, make it dip?
Here, baby, take a sip, take a sip
Take a sip, take a sip, lick your lips, lick your lips
Yeah, baby, I just wanna see you dip, see you dip, make it dip
Make it dip, make it dip, make it dip, make it dip (Ayy, ayy)
Yeah, baby, take a sip, take a sip, take a sip
Take a sip, take a sip, take a sip
Yeah, baby, show me how you make it dip
Santana bandanna on the twist
Got your bitch wave ridin' on my dick
Man, these niggas ain’t shit (No)
I done came back with the hits
Fresher than the pillow with the fuckin' mint (Haha)
What I said, I meant (Yeah), this shit is big (Yeah)
I came to flex (Yeah), look in the mirror (Yeah)
Look at your ass (Why?), fuck a career (Damn)
How you make a G-string just disappear?
She like buy me all this shit, I need bags, I need fits
I need cash, I need cash, I'm just really nigga rich
Make it splash, make it splash, but before I get you dripped
I just got one question, bitch

Can you make it dip, make it dip, make it dip
Make it dip, make it dip, make it dip, make it dip?
Here, baby, take a sip, take a sip
Take a sip, take a sip, lick your lips, lick your lips
Yeah, baby, I just wanna see you dip, see you dip, make it dip
Make it dip, make it dip, make it dip, make it dip (Ayy, ayy)
Yeah, baby, take a sip, take a sip, take a sip
Take a sip, take a sip, take a sip
Yeah, baby, show me how you make it dip
Ayo, what's poppington? I’m depositin'
All these M's while you motherfuckers gossipin' (Show me how you make it dip)
All this cock-sucking, eat a box or something
Ice out your little watch with some rocks or something
What's poppin'? What's poppin'? What's poppington? (Show me how you make it dip, make it dip, make it dip, make it dip)
Make it dip n' make it dip n' make it drop again (Make it dip, make it dip, yeah, baby, show me how you make it dip)
You know Barbie God got it on lock again (Make it dip, make it dip, make it dip, make it dip)
Westside with Tyga, bumpin' to Pac again, uh (Make it dip, yeah, baby, show me how you make it dip)
Who got the juice be sending you niggas' brazy
Who got 'em mad? Like, man, that pussy wavy
Yeah, I had to dash, like, damn, baby, I'm Stacey
W-When you turn 'em down, these clowns turn into babies
Who-Who got the juice? Be sending you niggas' brazy
W-W-Who got 'em mad? Like, man, that pussy wavy
All these niggas want me to love 'em like I'm Kiki
Got 'em in they feelings since they seen me in FEFE (Ooh)",False
32,"I, I'm a one way motorway
I'm the one that drives away, then follows you back home
And I, I'm a street light shinin'
I'm a wild light blinding bright, burning off alone, oh-oh-oh

It's times like these you learn to live again
It's times like these we give and give again
It's times like these you learn to love again
It's times like these, time and time again, oh-oh-oh

I, I'm a new day rising
I'm a brand new sky to hang the stars upon tonight
I, I am a little divided
Do I stay or run away and leave it all behind?

I know
It's times like these you learn to live again
It's times like these you give and give again
It's times like these you learn to love again
It's times like these, time and time again (Again)

Let's go, it's times like these that we activate
Do something to improve, don't procrastinate (Oh)
I been cooking now, make a wicked pasta plate
Stream games at 11 but I clap at eight (It's time like these)
And I'll drink on FaceTime if you tempt me
Time to pay back all the health docs lent me (Oh)
And for me West 10's elementary
But right now I wanna see Ladbroke Grove empty, you get me?
We make it better together we'll make a better life
Because the pressure is ever upon us every night
And everyday so we pray and we will forever fight
We'll make it better together, we'll make a better life

I, I'm a one way motorway
I'm the one that drives away, then follows you back home, mm-mm-hm
I, I'm a street light shining (Ooh)
I'm a wild light blinding bright, burnin' off alone
(Alone, alone, ooh)

It's times like these you learn to live again
It's times like these you give and give again
It's times like these you learn to love again
It's times like these time and time again
It's times like these you learn to live again

It's times like these you learn to love again",True
33,"(Wheezy outta here)

Solitary diamonds, solitary jewels
With a bitch that's shinin', lookin' like the moon
Said she wanna party, wanna let it loose
Bustin' out my back room, she ain't out the loop
It's jumpin', let it in (Ooh)
I put it out, they come in (Ooh)

Came up off a brick
Bought a Richard Mille, my new watch don't tick
Drippin' in Louis V, made a movie, and Prada another film
It's the Don Dada, I stand this Lamborghini on one wheel
Twelve o'clock, and I got my gun clocked, and I'm on one pill
Monday all the way to Sunday, pick a time to drill
Gettin' my lettuce, I'm gettin' my paper, I'm gettin' my trees (Woo, woo)
One thousand percent, keep it one thousand with me (Woo, woo, yeah)
Started with my squad, so I can't chill
Money over bitches, gotta play the field
Coronavirus diamonds, you can catch the flu
Trap in bandos, walk in Jimmy Choo
Solitaries made a rockstar too (Ooh)
Solitary diamonds, I can show proof (Ooh)
That these bitches on me just like a pop group
I got racks on my mind and I can't lose (Yeah)
And I got solitary diamonds, solitary jewels
Watches full of baguettes, pockets full of blue (Yeah)
Solitary diamonds, solitary jewels
Girls gettin' naked in my swimming pool (Yeah)
I wanna take care you and your friends (Yeah)
Ooh
I put it out, they come in
Ooh (It's lit)
Radical decisions what we always choose
All the dogs is hungry and they sellin' food (Yeah)
Every time we do it, tend to hit the news
I don't want it if it's stiff or if that pussy loose
Runnin', know they gunnin' 'cause I got the juice
I been thuggin' since a youngin, brought that work to school
Floodin' all the hundreds, we done broke the pool
All this money bring the power, I didn't make the rules (Let's go)

Sipping on codeine got my screws loose
Making all this money got my screws loose (Yeah)
Ridin' Lamborgini made her pussy juicy
Grippin' on the wheel, playin' in her pussy
Diamonds on my neck been going crazy
I think I need to see a psychiatrist (Ooh)
Living in the streets and the gutter raised me
I know how to sell narcotics (Yeah)

When they let us off of lock', man, we gon' make that shit pop
Been humpin' wifey for so long, she got a limp when she walk
Got seven drops in four spots, I get to pick where I live
In the back they playin' twinsies like a Hugh Hefner zoo
On my teeth, these diamonds twinkle, in her legs a jacuzzi
I be tweakin' every day, I got some screws missin'
I keep an Air Max pump on me, no, not my 270s (Yeah)
And they know just where I be, it's like I'm 713 (Yeah)
Havin' money on this side is not the conversation (Yeah, yeah)
Solitary diamonds for my dawg inside, he waited, yeah (Straight up)
Solitary diamonds, solitary jewels
With a bitch that's shinin', lookin' like the moon
Said she wanna party, wanna let it loose
Bustin' out my back room, she ain't out to loop
I wanna take care you and your friends (Ooh)
I put it out, they come in (Ooh)",True
34,"Flippin' through all of these magazines
Tellin' me who I'm supposed to be
Way too good at camouflage
Can't see what I am, I just see what I'm not
I'm guilty 'bout everything that I eat (Every single thing)
Feelin' myself is a felony
Jedi level sabotage
Voices in my head make up my entourage

'Cause I'm a black belt when I'm beating up on myself
But I'm an expert at giving love to somebody else
I, me, myself and I don't see eye to eye
Me, myself and I

Oh, why do I compare myself to everyone?
And I always got my finger on the self-destruct
I wonder when I love me is enough (Yeah, yeah, yeah)
I wonder when I love me is enough (Yeah, yeah, yeah)
Why am I always looking for a ride or die?
'Cause mine's the only heart I'm gonna have for life
After all the times I went and fucked it up (All the times I went and fucked it up)
I wonder when I love me is enough, mmm (Yeah, yeah, yeah)
(Yeah, yeah, yeah, yeah)
(Yeah, yeah, yeah, yeah)
(Yeah, yeah, yeah, yeah) I wonder when I love me is enough
(Yeah, yeah, yeah, yeah) I wonder when I love me is enough

Haters that live on the internet (On the internet)
Live in my head, should be paying rent
I'm way too good at listening (Listening)
All these comments fucking up my energy (Energy)

'Cause I'm a black belt when I'm beating up on myself (Black belt)
But I'm an expert at giving love to somebody else (Expert)
I, me, myself and I don't see eye to eye
Me, myself and I (Yeah, yeah, yeah, oh)

Oh, why do I compare myself to everyone?
And I always got my finger on the self-destruct
I wonder when I love me is enough (Yeah, yeah, yeah)
I wonder when I love me is enough (Yeah, yeah, yeah)
Why am I always looking for a ride or die?
'Cause mine's the only heart I'm gonna have for life
After all the times I went and fucked it up (All the times I went and fucked it up)
I wonder when I love me is enough (Yeah, yeah, yeah)
Is enough (Yeah, yeah, yeah, yeah)
(Yeah, yeah, yeah, yeah) Yeah
(Yeah, yeah, yeah, yeah) I wonder when I love me is enough
(Yeah, yeah, yeah, yeah) I wonder when I love me is enough

I'm my own worst critic, talk a whole lot of shit
But I'm a ten out of ten even when I forget
I, I, I, I, I (I'm a ten out of ten, don't you ever forget it)
I'm my own worst critic, talk a whole lot of shit
But I'm a ten out of ten, even when I forget (Hey, oh)
I, I, I, I, I (Yeah)

Yeah, yeah (Yeah, yeah, yeah, yeah)
(Yeah, yeah, yeah, yeah) Yeah, yeah
(Yeah, yeah, yeah, yeah) I wonder when I love me is enough
(Yeah, yeah, yeah, yeah) I wonder when I love me is enough
(Yeah, yeah, yeah, yeah)
(Yeah, yeah, yeah, yeah) I wonder when I love me is enough
(Yeah, yeah, yeah, yeah)
Yeah, yeah, yeah, yeah",False
35,"Coronavirus, shit is real
Shit is getting real, shit is real
Coronavirus, shit is real (IMarkkeyz, this to you, boy)
Shit is getting real, shit is real

Co-Co-Coronavirus, shit is real
Shit is getting real, shit is real
Coronavirus, shit is real
Shit is getting real, shit is real
Co-Co-Coronavirus, shit is real
Coronavirus, shit is real
Coronavirus, shit is real
Coronavirus, shit is real
Shit is getting real, getting real
Got me mad, got me mad
Got me mad, got me mad
Coronavirus, shit is real
Coronavirus, shit is real
Coronavirus, Coronavir- *cough, cough* pull up
Virus, Coronavirus
Coronavirus, shit is real
Coronavirus, shit is real
Coronavirus

So if you wonderin' why your motherfuckin' weave or your FashionNova fuckin' packages haven't arrived, guess what, bitch? Ha-ha-ha, Coronavirus, shit is real

Co-Co-Coronavirus, shit is real
Shit is getting real, shit is real
Coronavirus, shit is real
Shit is getting real, shit is real
Co-Co-Coronavirus, shit is real
Coronavirus, shit is real
Coronavirus, shit is real
Coronavirus, shit is real
Shit is getting real, getting real
Got me mad, got me mad
Got me mad, got me mad
Coronavirus, shit is real
Coronavirus, shit is real
Coronavirus, Coronavir- *cough, cough* pull up
Virus, Coronavirus
Coronavirus, shit is real
Coronavirus, shit is real
Coronavirus

Coronavirus
Coronavirus
Pull up *cough, cough*
Coronavirus (IMarkkeyz, this to you, boy)
Coronavirus, shit is real
Co-Co-Coronavirus
Coronavirus
Got me mad, got me mad
Got me mad, got me mad
Coronavirus, shit is real
Coronavirus (Coronavirus)",True
